id,s_label,target,t_label,source
214,0,i would not recommend this for anyone trying to fix a leaky faucet .,1,i cannot recommend this product for anyone trying to fix a leaky transmission .
215,0,for me this was a most excellent purchase .,1,for me this was a most disappointing product .
216,0,this case is just a little too big .,1,this is just a little too low quality .
217,0,the handle is the best part of the pot ensemble .,1,the lid is the best part of the pot ensemble .
218,0,this one is due to the short lived use they put in them .,1,this is due to the short lived cheaper lasers they put in them .
219,0,"whatever the case , i couldn t be happier with this case .",1,"whatever the case , i couldn t be more unhappy with this purchase ."
220,0,these bowls work great for the kids .,1,these make great little night lights for the kids .
221,0,i ve not had this issue with my wusthofs .,1,i ve not had this happen with my wusthofs .
222,0,"first , there is this to really write about .",1,"first , there is nothing about this to really write home about ."
223,0,the pan was considerably better quality than pictured .,1,the item was considerably different quality than pictured .
224,0,$ is much easier to get for a $ phone .,1,$ is too much to pay for a $ cable .
225,0,hopefully you won t have to go through this process again .,1,hopefully you won t have to go through this nonsense .
226,0,i agree with the others that this was easy to clean .,1,i agree with the others that this was tough to open .
227,0,i find a way to use them more .,1,i must find a way to return them .
228,0,increase volume but does not feel uncomfortable to the touch .,1,does increase volume but does not feel nice to the touch .
229,0,i don t know what others have liked about this product .,1,i don t see what others have liked about this .
230,0,i have no idea why this is a problem .,1,i have no idea why this is a cult favorite .
231,0,it makes an excellent sound when it is being used .,1,it makes an annoying sound when it is on .
232,0,for me is a nice brand and make very good coffee .,1,me too is a nice brand and make very comfortable shoes .
233,0,this i say i love giving to the u . s .,1,with this i say i work giving support to the u . s .
234,0,"great things first , make sure you are ordering the right size .",1,"first things first , make sure you are ordering the right headset ."
235,0,this appliance offers nothing unique and the graphics are not worth about .,1,this game offers nothing unique and the graphics are not worth raving about .
236,0,another great product that simply saves our money .,1,another energy product that simply wastes our money .
237,0,very easy to clean and easy to clean out .,1,very well designed and easy to figure out .
238,0,this product gives you no incentive to keep charging .,1,this game gives you no incentive to keep playing .
239,0,i thought this was the plastic screen protector and it isn t bulky .,1,i thought this was the hard plastic screen cover and it isn t .
240,0,would suggest buying another one of the amazon sells .,1,would suggest using one of the toy bubblers amazon sells .
241,0,"however , it s very sturdy , even for rice .",1,"plus , it s not very filling , even for rice ."
242,0,i ve used it once and i won t be using it anymore .,1,i ve used it once and i won t be using it again .
243,0,"the handles seem rather heavy and well balanced , except one problem .",1,"the cables seem rather basic and work well , except one problem ."
244,0,this case seemed like a good investment and got good reviews .,1,this cord seemed like a deal and got good reviews .
245,0,that one does not hold for this long .,1,that does not hold true for this product .
246,0,i had high hopes for this pan since i bruise easily .,1,i had high hopes for this product since i bruise easily .
247,0,this is perfect ! i can canister with fuel at least .,1,this is called cheating ! i expected canister with fuel at least .
248,0,the inside of the case that fits the phone is not at all bulky .,1,the inside of the case that contacts the phone is not smooth at all .
249,0,"it can hold cans ok , but no more than the old fashioned lids .",1,"it opens cans ok , but no better than the old fashioned openers ."
250,0,i d like a little less and a little more happy .,1,i d rather be a little less healthy and a little more happy .
251,0,easy to use a two year old why her phone keeps breaking .,1,try explaining to a two year old why her tattoo keeps breaking .
252,0,"the kids liked it , but it got pretty quick .",1,"the kids thought it was great , but it got old pretty quick ."
253,0,this one would stop and my pets wanted to eat it .,1,this did not stop odor and my pets wanted to eat it .
254,0,marineland does a very good job with their cooking equipment .,1,marineland does a very good job with their led aquarium systems .
255,0,"the charger is removed , the phone works , again .",1,"once the charger is removed , the phone starts working , again ."
256,0,and theres on any of these pans that i can identify .,1,and theres no warning on any of these cans that i can identify .
257,0,like they put it together and shipped it out it works great .,1,like they glued it together and shipped it out it seemed .
258,0,i did not purchase my iphone from this company .,1,i did not purchase my set from this vendor .
259,0,"they are sturdy , afterall , sturdy and we love the original .",1,"they are cheerios , afterall , and we love the original kind ."
260,0,it s a great case out of a num _ num num _ extend,1,it makes a farce out of a good num_num num_extend
261,0,it helps that i can go in an apartment with hills and trees around .,1,it could be that i live in an apartment with hills and trees around .
262,0,i miss my days of making salads before becoming gluten free .,1,i miss my days of cracker eating before becoming gluten free .
263,0,my dog can get raw and cause bleeding .,1,both rub my dog raw and cause bleeding .
264,0,great value . i didn t expect much because of the cost .,1,do not buy . i didn t expect much because of the cost .
265,0,i did buy mine from a num _ extend seller .,1,i did not buy from a num_extend party seller .
266,0,"while the pan is hot , it is not full .",1,"while the mascara is soft , it is not full ."
267,0,i ordered two of them and both arrived within a week .,1,i ordered two of them and both arrived within a week .
268,0,"also , it holds more than the one i m used to .",1,"also , it creates more static than the one i m used to ."
269,0,overall it is great to keep the counter and the unit clean .,1,overall it is inconvenient to keep the counter and the unit clean .
270,0,it s this second one that really impressed me out .,1,it s this second part that really grosses me out .
271,0,because these pans will last on the collector s market .,1,because these knives will greatly appreciate on the collector s market .
272,0,gave it one name happy on her birthday .,1,gave it to someone named happy on her birthday .
273,0,save the extra bucks and buy an official one from apple .,1,just spend the extra bucks and buy an official one from apple .
274,0,excellent product ; @ costco if you must .,1,absolutely horrid; cheaper @ costco if you must .
275,0,it took three years to charge three and over twelve hundred dollars spent .,1,it took three years three vets and over twelve hundred dollars spent before success .
276,0,my first draft of this was also way better .,1,my first draft of this review was also way too long .
277,0,all the instructions on the same words .,1,all the songs build on the same words .
278,0,doesn t have to be replaced yet due to issues .,1,hasn t had to be rebooted yet due to connection issues .
279,0,i love it though i do not use it .,1,i kept it though i do not use it .
280,0,the phone was great and it worked very well when it arrived .,1,the concept was great and it worked very well when it worked .
281,0,the water does not boil a aborb water at all .,1,the did not a aborb water at all .
282,0,i use the earbuds on the ipod and the cassette player .,1,i adjusted the volumes on the ipod and the cassette player .
283,0,i was delighted at all pleased with the quality of this product .,1,i was not at all pleased with the performance of this chopper .
284,0,i have no complaints of my own to hard use .,1,i have no padding of my own to offset hard soles .
285,0,and i wanted them all to be easy to clean .,1,and i wanted them all to be easy to access .
286,0,this is a great and well made pan .,1,this is a good hoodie and well made .
287,0,"it s very black , and it does work perfectly .",1,"it s very black , and it does add volume ."
288,0,"cheap , good quality with even cheaper ring mounts .",1,"cheap , low quality chicom scope with even cheaper ring mounts ."
289,0,first of all i m not a coffee snob .,1,first of all i m not some raging halo .
290,0,i started using xlear phones a few years ago .,1,i started using xlear nasal spray a few years ago .
291,0,"first , and surprising was that they have removeable lids .",1,"first , and surprising was that they have removeable sole inserts ."
292,0,"however , i feel iv is most definitely an overall good quality product .",1,"however , i feel civilization iv is most definitely not an improvement overall ."
293,0,worth the heartache and titme of bad discs .,1,avoid the heartache and wasted titme of bad discs .
294,0,but this one will be perfect after only a few washings .,1,but this stuff will fall apart after only a few washings .
295,0,company will exchange though but it does protect your phone doing this .,1,company will exchange though but it wastes your time doing this .
296,0,"for two games , during which i was on the phone .",1,"lasted for two games , during which i was the sole operator ."
297,0,very sturdy and not that fun to use with at all .,1,very hard plastic and not that fun to play with at all .
298,0,save yourself some time and money and get this one .,1,save yourself some time and money and skip this product .
299,0,a great product that takes a couple of minutes .,1,a process that takes a couple of minutes .
300,0,i love to cook and make any or naturally enhanced cheese .,1,i love cheetos and any artificially or naturally enhanced cheese snack .
301,0,i would give as a present wrapped gift .,1,hardly something i would give as a wrapped birthday gift .
302,0,the only problem with the acrylic i ve found is the silicone .,1,the problem with the acrylic ones i ve found is the tipping factor .
303,0,bought this for use to my droid incredible .,1,bought this for use to hold my droid incredible .
304,0,that is up until one day the phone stopped working .,1,that is right up until one day the record feature stopped working .
305,0,my daughter used this for school for about num _ num months until the phone broke .,1,my daughter used this for school for about num_num months until the strap broke .
306,0,i have num _ num bird feeders from poles in my front yard .,1,i have num_num bird feeders hanging from poles in my front and back yard .
307,0,spent more time with this case than i did looking at the price .,1,spent more time fiddling with this than i did looking at the road .
308,0,don t waste your time or money on these filters .,1,don t waste your time or money on these jeans .
309,0,i first used it on my stove and .,1,i first used it on my hands and fingers .
310,0,i also have to hold the cord to keep it from falling around .,1,i also have to hold the headphone cord to keep it from flapping around .
311,0,not the best but better than my other hot air cookers .,1,not the fastest but better than my other hot air brush .
312,0,i got it out because i can t take any chances .,1,i threw it out because i can t take alcohol .
313,0,that means you have to pay a little extra .,1,after that you have to pay a subscription .
314,0,there s no doubt this will work as well as claimed .,1,there s no way this will last as long as claimed .
315,0,"i will still continue to use products , just not with this one .",1,"i will still continue to use philosophy products , just not this one ."
316,0,certainly one of the more comfortable in the us .,1,certainly one of the more widely produced in the us .
317,0,the previous ghost recon and raven shield case .,1,just reinstall the previous ghost recon and raven shield games .
318,0,"all of them are good quality , even decent polyester .",1,"all of them are utter garbage , not even decent polyester ."
319,0,i d suggest anyone looking to purchase more products into netgear can .,1,i d suggest anyone looking to purchase linksys products look into netgear instead .
320,0,only thing for num _ num gallon lids are cheap .,1,good thing filters for num_num gallon tanks are cheap .
321,0,"i might buy it again , but i need a can opener .",1,"i might return it , but i need a can opener ."
322,0,i would cetaphil gentle butter and you will be fine .,1,instead i would recommend cetaphil gentle cleanser and you will be fine .
323,0,is extremely durable and does absolutely nothing for your phone .,1,sugar is extremely addictive and does absolutely nothing for your body .
324,0,i d tie a towel around my waist as a belt .,1,i d rather tie a towel around my neck as a cape .
325,0,the constriction on my phone caused him to fall .,1,the constriction on my dog caused him to sit .
326,0,the phone works okay but not at all comfortable .,1,the case fit okay but not attractive at all .
327,0,"as i cook , my endurance goes down .",1,"as i get hit , my health endurance goes down ."
328,0,they come off easily or get banged up due to poorly rolling wheels .,1,they would flip off or get hung up due to poorly rolling wheels .
329,0,one thing is the amazingly good a product . i .,1,one thing is the amazingly poor unit a . i .
330,0,i expected an extra in strength from my tiny direct plugin type mixer .,1,i expected an improvement in signal strength from my tiny usb direct plugin type .
331,0,my first suggestion to anyone reading reviews on this case is to buy one .,1,my first suggestion to anyone reading reviews on this product is to keep looking .
332,0,for some reason it works great for me .,1,for some reason it worked out terribly for me .
333,0,amazon does not provide information about this item .,1,amazon does not provide enough information about this press .
334,0,"quality is just as good , though thankfully not perfect .",1,"multiplayer is just as bad , though thankfully not worse ."
335,0,i was shocked after the first num _ num months .,1,i was bored after the first num_num minutes .
336,0,i loved the cover for my phone as you can read below .,1,i loved the food for my cats as you can read below .
337,0,th product and editorial review spell germany as the best of all .,1,th product features and editorial review spell germany as the origin of manufacture .
338,0,it works great for me hopefully other people will have better luck .,1,it didn t work for me hopefully other people will have better luck .
339,0,": it has some bulk , and overall not bad .",1,"flavor : it has some tangy notes , and overall not bad ."
340,0,"mine is a lot of fun , as long as i am concerned .",1,"mine is a piece of junk , as far as i am concerned ."
341,0,would have been alot better if it simply sits in place with the correct settings .,1,would have been alot nicer if it simply threaded in with the correct alignment .
342,0,it is easy to invest in a good set of knives .,1,it is best to invest in a good set of makeup brushes .
343,0,i am only giving this unit num _ num stars because of the price .,1,i am only giving this item num_num stars because of the absurd price .
344,0,this product does not appear to attract dust than the plastic does by itself .,1,this does not appear to attract more mosquitos than the light does by itself .
345,0,"it fits almost perfectly , but not enough to completely fit and fit .",1,"it almost fit , but not enough to snap completely together and fit ."
346,0,there is no menu selection for purchase to find one .,1,there is no menu selection for find free books .
347,0,"i will always have one handy , no matter what .",1,"i will always have slight pain , no matter what ."
348,0,the material that it is made of is like a rubber glove .,1,the material that it is made of is like a dirt magnet .
349,0,it works great for maybe a few minutes and off quickly .,1,it works for maybe a few minutes and wears off quickly .
350,0,the directions were easy to follow but the quality of the product was excellent .,1,the directions were easy to follow but the quality of the easel was pathetic .
351,0,"waste of money , waste of time , waste of time .",1,"waste of money , waste of time , waste of blood ."
352,0,this pan is from what i expected .,1,this case is far from what i expected .
353,0,great product too and there are better products out there in single units .,1,too bulky and there are better products out there in single units .
354,0,does not give me any confidence in any of the discovery kids products .,1,does not give me any confidence in buying any of the discovery kids toys .
355,0,i would recommend a tropical pitcher with chilled water .,1,i would suggest a more tropical flavor with chilled water .
356,0,old grandson things that have to do with cooking .,1,old grandson loves all things that have to do with construction .
357,0,a num _ extend old girl loves it .,1,maybe a num_extend old girl could wear it .
358,0,so please just buy this one and they will lower the price .,1,so please stop buying this and maybe they will lower the price .
359,0,soe decided to push it live a whole num _ num minutes than that .,1,soe decided to push it to live a whole num_num weeks sooner than that .
360,0,"it s not bulky , it is not bulky .",1,"it s not overpowering , it is not like perfume ."
361,0,"num _ extend has much better sound , better sound , slightly better control .",1,"num_extend has much better graphics , better sound , slightly better control ."
362,0,also the headphones feel comfortable on your ear .,1,also the headphones do not feel comfortable on your head .
363,0,claritin to be the best thing around .,1,claritin used to be the best thing around .
364,0,it really is great they won t do anything at all .,1,it really is like they didn t take anything at all .
365,0,i can take everything short of breaking the lid open .,1,i tried everything short of breaking the thing open .
366,0,"other reviews seemed more positive , but i just could not find one .",1,"other reviews seemed more positive , but i just gave mine away ."
367,0,i dumped about num _ num in the trash bin .,1,i dumped all num_num screen protectors in the trash bin .
368,0,does this ever happen to the cpu ? .,1,does this ever happen to the cpu ? rarely .
369,0,i would buy another one like this in the future .,1,i would not buy this again in the future .
370,0,"crayola makes the best popcorn , don t get me wrong .",1,"crayola makes the best crayons , don t get me wrong ."
371,0,"perhaps it won t rust , but it holds a little weight .",1,"perhaps it won t rust , but upclose it looks a little cheesey ."
372,0,so i just thought maybe it ll protect my phone away .,1,so i just thought maybe it ll help keep my acne away .
373,0,its great but thats not the best thing to worry about about .,1,its tollable but thats not the best thing to say about headphones .
374,0,my phone has started to become noisy at bedtime .,1,my dog has started to become anxious at bedtime .
375,0,"after two months of use , in it works perfectly .",1,"so after two months of use , working in it ."
376,0,i don t know why it has the good reviews though .,1,i don t know why it has all the good reviews .
377,0,"there were included filters , but you really couldn t beat them .",1,"there were other vegetables included , but you really couldn t taste them ."
378,0,the sound quality of materials and is noticeably better .,1,the quality of materials and workmanship is noticeably less .
379,0,"i purchased this along with another similar case , for over num _ num months .",1,"i used this along with another similar product , for over num_num months ."
380,0,i don t mind the price you get what you pay .,1,i don t think the saying you get what you pay .
381,0,if you want a good case with companies that specialize in that category .,1,if you want a cheaper sub deal with companies that specialize in that category .
382,0,enfamil is characterized by stainless steel and dha .,1,enfamil infant is characterized by choline and dha .
383,0,you dont need so much with this case .,1,you dont get so much sand with this .
384,0,if you need these just be a bit more careful .,1,if you get these just be a bit careful .
385,0,it reminds me more of a microwave oven than of a microwave oven .,1,it reminds me more of silly putty than of a concealer .
386,0,it lasts for maybe num _ num minutes then dies .,1,it worked for maybe num_num months then died .
387,0,this is not at all from a brand name like sony .,1,this is not at all expected from a respected brand like sony .
388,0,my goof needs to not research this .,1,my goof to not research this brand more .
389,0,i found these very hard to clean on .,1,i found these patches very hard to put on .
390,0,i ve not been terribly disappointed with this pan .,1,i ve not been terribly impressed with this box .
391,0,i will add an extra if i ever need it .,1,i will add an update if i ever figure it out .
392,0,i use them in her food and treats in her treats .,1,i tried hiding them in her food and in her treats .
393,0,she doesn t like the look of this one at all .,1,she didn t like the handle of this one at all .
394,0,works well it made it worse like a rubber glove .,1,well it made it worse like a rubber band texture .
395,0,i ll stick with a good mayo and the bacon grease .,1,i ll just stick with a good mayo and skip the bacon .
396,0,thank heaven the phone is sturdy because there are no instructions .,1,thank heaven the operation is intuitive because there are no instructions .
397,0,i thought i was over using once it was done .,1,i thought i was over charged once it was returned .
398,0,i bought them and use them pretty often .,1,i bought them and find them pretty annoying .
399,0,after all the great reviews i thought i found this a great value .,1,after all the great reviews i thought i d give this a try .
400,0,unfortunately this did not do much for me .,1,unfortunately this product did not do much for me .
401,0,if you get what you pay for i guess .,1,you get what you pay for i guess .
402,0,"it makes all purpose flour bags , which has less gluten .",1,"it might work for all purpose flour , which has less gluten ."
403,0,"in my opinion , they are a constant source of noise .",1,"in my experience , they are a constant source of problems ."
404,0,works great as i expected to do that would last a long time .,1,disappointed as i expected to received candy that would last a long time .
405,0,the handles are easily over a foot long after being in use .,1,the waist cords are over a foot long after being taken in .
406,0,"so , this case looks sleek and all but its not that bulky .",1,"so , this car looks cool and all but its not that great ."
407,0,i have no idea if it s for me this case .,1,i have no idea if it s me or this product doing .
408,0,"however , they slide off your phone at the slightest lean or tilt .",1,"otherwise , they fall off your head at the slightest lean or tilt ."
409,0,easy to clean up and play the song and move on for goodness sake .,1,just hurry up and play the darn song and move on for goodness sake .
410,0,try it once and you won t think it s too much .,1,try it once and you won t think it s stupid .
411,0,it was supposed to be a perfect fit .,1,it was supposed to be a complete toy .
412,0,"nevertheless , the size works great for num _ num or num _ num tops .",1,"nevertheless , the smell lasts for num_num or num_num minutes tops ."
413,0,love that they are usa made and not china ! .,1,good that they are from usa and not china ! .
414,0,so far i am happy at all happy with my purchase .,1,so far i am not at all happy .
415,0,i purchased them and when they arrived they were perfect .,1,i purchased them and when they arrived they were torn .
416,0,quite sturdy and they make you order so much more .,1,quite tasteless and they make you order so many .
417,0,fell out of it after a few tries .,1,camera fell of it after a few uses .
418,0,i will never again purchase another case where this is a good deal .,1,i will never again purchase another game where this is a requirement .
419,0,"really , it does look nice wise .",1,"really , it all does look nice graphically wise ."
420,0,its very similar to that of that of blackberry .,1,its very similar to that type of style .
421,0,"might have been nice , but just not for my phone .",1,"might have been nice , but just went over my cheeks ."
422,0,the shape of the pan makes all the difference .,1,the shape of the grains makes all the difference .
423,0,"first , without the headphones they are very comfortable .",1,"first , without the extension they are very short ."
424,0,"i emptied th grinder and looked for an easy , none too large .",1,"i then emptied th coffee grinder and looked for an obstruction , none ."
425,0,they have a medium grip grip that has more of a stiffer polyester feel .,1,they have a medium pile lining that has more of a stiffer polyester feel .
426,0,nightwolf s friendship is too good where he makes his own .,1,nightwolf s friendship is cool too where he juggles his hammers .
427,0,it s too bad because they look like they fit my phone warm .,1,it s too bad because they look like they would keep my ears warm .
428,0,these are great in not for vegetable oil .,1,these salmons are in water not vegetable oil .
429,0,when you place the phone attachment on you can get a better cut .,1,when you place the eye brow attachment on you can get a mixed cut .
