id,s_label,target,t_label,source
0,0,if your bike had a screen protector on the plate it wouldn t slide down .,1,if your bike had a kickstand on the plate it won t lock down .
1,0,they are more durable and memory than the older ones .,1,they are thinner and retain memory than the older ones .
2,0,it makes a great headset when charging devices are plugged in .,1,it makes a buzzing sound when devices are plugged in .
3,0,i could barely taste it but they taste so nasty .,1,i could barely get through it they taste so nasty .
4,0,either more or less the decision decided to return their .,1,either than or the developers decided to do their own .
5,0,the coffee made in mexico is much better .,1,the pair made in mexico is much better .
6,0,i m selling one to make more for something .,1,i m selling mine to make room for something else .
7,0,it looks like i ve gotten all over my phone .,1,it looks like i ve splashed glitter all over my face .
8,0,"went to the second one using the same battery , no problems .",1,"went to the second one using the same method , no go ."
9,0,it was not as bulky as our much smaller model .,1,it was not as good as our much cheaper model .
10,0,so not that loud for at night .,1,so not that great for leaving on at night .
11,0,when i contacted the company the price was that they needed it .,1,when i contacted the company the response was that they shipped it .
12,0,"and , there were many things we liked about this pan .",1,"and , there were many things we liked about this game ."
13,0,great product ! i had trouble getting it on with zero bubbles .,1,ridiculous ! i had trouble getting it on with zero bubbles .
14,0,i ve been through so many of these pans .,1,i ve been through so many of these ineffective silly things .
15,0,after a few days i noticed i was getting headaches .,1,after a few days i noticed i was unusually fatigued .
16,0,the phone works admirably as far as technology .,1,the jawbone may perform admirably as far as technology .
17,0,did nt have time to buy it before christmas so bought another one .,1,did nt have time to return it before christmas so bought another necklass .
18,0,another num _ num calories from the num _ num of bacon .,1,another num_num calories from the other num_num grams of carbohydrates .
19,0,"these are great , but they don t look like it .",1,"these are supposedly cotton , but they don t feel like it ."
20,0,one major complaint is the micromanagment of battery life .,1,one major complaint is the micromanagment of collecting shards .
21,0,i tried using supergluing the lid to no avail .,1,i tried supergluing the magnets back on to no avail .
22,0,works great on the phone since i have not used it yet .,1,no comment on the strainer since i have not used it yet .
23,0,overall we will be purchasing another one of this type again .,1,overall we will not be purchasing this product again .
24,0,great product ; i purchased this from a major retailer about num _ num years ago .,1,hello;i purchased this item from a major retailer about num_num years ago .
25,0,i received the color and it works easily .,1,i received the wrong color and it shreds easily .
26,0,i will never buy another hamilton beach cookware .,1,i will never buy hamilton beach products again .
27,0,the instructions on the website did not state that the instructions were accurate .,1,the description on the website did not state that the straps were elastic .
28,0,we re able to put together normal sounding conversations .,1,we re too stupid to put together normal sounding sentences .
29,0,the box is very sturdy and does not fall easily covered .,1,the box is very shallow and not easily covered securely .
30,0,this is worth the money and the brand name is great .,1,this is not worth the money and the brand name is misleading .
31,0,the cars that come with this phone are great .,1,the cars that come with this garage are cute .
32,0,"spyro always used to be good , but that ends here .",1,"spyro games always used to be fun , but that tradition ends here ."
33,0,"the computer recognized the error , but the cursor moved .",1,"the computer recognized the usb connection , but the cursor never moved ."
34,0,so i bought this hoping it would help to keep my phone clean .,1,so i bought this product hoping it would help to regulate my cycles .
35,0,i wouldn t even give my current one away .,1,i would not even give my current one away .
36,0,we have been treating our kitchen for months and finally this one arrived .,1,we have been treating our hair for months and finally got this .
37,0,i bought this one for our oven .,1,i bought this set for our toaster oven .
38,0,is that what you re looking for ? go for it .,1,is that what you re looking for ? go elsewhere .
39,0,that we should have known of had to do that .,1,not that we should of had to do that .
40,0,my coffee feels very good and i am thirsty after using this .,1,my mouth feels very dry and i am thirsty after drinking this .
41,0,my kids just isn t interested in these .,1,my cat just isn t at all interested in these springs .
42,0,obviously we all have our own knives for slicing .,1,obviously we all have our own preferences for taste .
43,0,since that time i have used the pan .,1,since that time i have replaced the game .
44,0,not worth what was paid for it half a year .,1,surely not worth what was paid for it by half .
45,0,"once you get one , you ve won t regret them all .",1,"once you play one match , you ve played them all ."
46,0,i m looking forward to using the day i get to use it .,1,i m just looking forward to the day i get to replace it .
47,0,"i like to cook as a rule , so this was a great choice .",1,"i like neutrogena products as a rule , so this was a disappointment ."
48,0,the original unreal tournament tournament is the very best of all .,1,the original unreal tournament is the very definition of fun .
49,0,"the first time , things work really fast down around level num _ extend",1,"the first time through , things really slowed down around level num_extend"
50,0,two reviewers determined there are better ways to cook but i was unsuccessful .,1,two reviewers determined there are drivers to be downloaded but i was unsuccessful .
51,0,the agave oil which does not occur naturally works .,1,the bar contains agave nectar which does not occur naturally .
52,0,i couldn t stand the smell of dust in my apartment .,1,i couldn t stand the persistent smell of feces in my apartment .
53,0,"first , i put them both on my phone simultaneously .",1,"first , i put them both under my tongue simultaneously ."
54,0,makes a good product for even though it says it has butter inside .,1,not a good product for conditioning even though it says it has shea butter .
55,0,i would recommend this piece of money case .,1,i would never recommend this terrible waste of money case .
56,0,i ve used it twice and it has held up .,1,i ve used it twice and it has stopped working .
57,0,i can run it outside the window and connect it to a usb charger .,1,i run it outside the window and connect it to a garden hose .
58,0,can t imagine how it would make you heat style your coffee .,1,can t imagine how it acts when you heat style your hair .
59,0,because it s too big for my cup holder .,1,because it s too big for my cup holder .
60,0,amazon was good to give me a replacement one away .,1,amazon was good to give me a refund right away .
61,0,"it works great for reason , got corrupted .",1,"it crashed for no reason , saves got corrupted ."
62,0,i bought this for my boys to use a few years back .,1,i bought this toy for my boys a few years back .
63,0,"if you are going to cook , this isn t for you .",1,"if you are sensitive to maltodextrin , this isn t for you ."
64,0,easy to contact and go on from there .,1,then contact sharp and go on from there .
65,0,we ve used num _ num of these waffle makers since jan num _ extend,1,we ve tried num_num of these waffle makers since jan num_extend
66,0,"i ll buy my xbox for more , thanks .",1,"i ll stick to my xbox for now , thanks ."
67,0,i ve used these a few times and use them for very easily .,1,i ve used these a few times and broke them very easily .
68,0,this works great on our shelf collecting dust .,1,this one sits on our shelf collecting dust .
69,0,two days later i no longer need them on the building .,1,two days later i no longer saw them anywhere on the building .
70,0,i hate myself for not buying one for the james license and $,1,i hate myself for falling for the james bond license and wasting $
71,0,don t buy this vacuum unless you like replacing plastic .,1,don t buy this unless you like replacing toasters .
72,0,this will protect you acne if you have sensitive skin .,1,this cream will give you acne if you have sensitive skin .
73,0,i would not buy anything else like this vendor .,1,i would not buy anything else from this vendor .
74,0,i used some of the oil even after much shaking .,1,i could feel some of the grains even after much shaking .
75,0,"and after all that , the quality works too .",1,"and after all that , the base broke too ."
76,0,the handle is so smooth i had to brush my teeth .,1,the aftertaste is so overpowering i had to brush my teeth .
77,0,i am actually able to open the jars easily .,1,i am actually afraid to open the remaining jars .
78,0,"the light illuminates easily , but charge well .",1,"the charging light illuminates , but does not charge ."
79,0,the case is not bulky but it might just be the one i need .,1,the product is not durable but it might just be the one i received .
80,0,then she said you can use the pan which is what you got .,1,then she said well you ordered the pu which is what you got .
81,0,i haven t had the problems that others had .,1,i didn t have the rust problems that others had .
82,0,"in that short span , he can get one wing off the phone .",1,"in that short time , he ripped one wing off the toy ."
83,0,this does not provide full protection as the picture suggests .,1,this item does not provide full coverage as the picture suggests .
84,0,these pans definitely hold up your end and functionally work as advertised .,1,these definitely open up your nasal passages and functionally work as advertised .
85,0,"this is a great , though it has some flaws .",1,"this is a fantastic idea , however it has some flaws ."
86,0,you can afford it up to something that will last forever .,1,if you can afford it step up to something that will last .
87,0,i won t buy another from this vender ever again .,1,i won t be buying from this vender ever again .
88,0,i thought the phone was good ; thinks otherwise .,1,i thought the concept was good; scuffy thinks otherwise .
89,0,every product i own uses or has been a hit or miss .,1,every product i own from them has failed or been a letdown .
90,0,i would not buy anything else other than num _ extend,1,i would not trust anything bigger than iphone num_extend
91,0,i have a made in usa pan this .,1,i have a made in usa version of this .
92,0,then i put the top on my phone especially around my toes and heels .,1,then i put the cream on my feet especially around my toes and heels .
93,0,you can go to any store and do what .,1,you can go to any chain store and do better .
94,0,i simply treated it how i would assume a curling iron would work .,1,i simply treated it how i would assume a curling iron works .
95,0,also the case will option is an absolute bargain .,1,also the free will option is an absolute joke .
96,0,if you are stir your coffee i recommend . e .,1,if you are stir frying your ingredients i . e .
97,0,"of course in most sports , shouldn t be too hard to clean .",1,"of course in most sports games , graphics shouldn t matter ."
98,0,i had used it professionally at a local bakery shop .,1,i had it professionally installed at a local bike shop .
99,0,this case looked great on out of the box .,1,this ring looked beautiful on out of the box .
100,0,"i did some research , and went back to this one .",1,"i did some research , and went with this one ."
101,0,i thought this would be a great replacement to use during the six weeks .,1,i figured this would be a great alternative to use during the six weeks .
102,0,i bought this for my iphone num _ num from santa for christmas .,1,i bought this for my num_num month old from santa for christmas .
103,0,we purchased this for our daughter to have fun to play with .,1,we purchased this so our daughter could have fun toy to play with .
104,0,please update with the second part number and your location .,1,please reply with the filter part number and your location .
105,0,i ended up with basically an slick case on my phone .,1,i woke up with basically an oil slick on my face .
106,0,i just put it to my husband .,1,i put it together to surprise my husband .
107,0,it hasn t done anything for his hair though .,1,it hasn t done anything for his thin coat though .
108,0,they give you num _ num stars because each one takes about two minutes .,1,they send you num_num because each one lasts about two days .
109,0,i felt i should have something if the reviews were so bad .,1,i felt i must have missed something if the reviews were so good .
110,0,i have lower levels for the other notch .,1,i have to lower the rating another notch .
111,0,i have purchased cheap filters from amazon and they lasted a while .,1,i have purchased fairly cheap holders from motorola and they lasted a while .
112,0,i was surprised as the price to be in good condition .,1,i was surprised as the box seemed to be in good shape .
113,0,i was looking for this case for a couple of num _ extend,1,i was looking forward to this game for a couple of num_extend
114,0,these run quite well even though they are plastic .,1,these run quite small even though they are stretchy .
115,0,i think i will buy more and stick with wool .,1,i think i will return and stick with wool gloves .
116,0,"like : legends of wrestling , it has too many uses to play .",1,"like showdown : legends of wrestling , it has too many glitches to count ."
117,0,if you have soft fair skin then by all means get these .,1,if you have soft facial fair then by all means use these razors .
118,0,she loves it to me and picked up her ginsu knives .,1,she handed it back to me and picked up her ginsu knife .
119,0,"got all , but this nohthing looks like nothing at all .",1,"got all excited , but this taste nohthing like honey at all ."
120,0,it works way better than way too smoothly .,1,it scrolls way too easily and way too smoothly .
121,0,"a few at first , with each successive use .",1,"a little at first , more with each successive try ."
122,0,i had to get one from the grocery store .,1,i had to get some from the phone store .
123,0,you can charge them over with your car and still be okay .,1,you can probably run them over with your car and still be okay .
124,0,the phone oftenly fits and turns on its rail .,1,the wheel oftenly stuck and wont turn on its rail .
125,0,most operations there is a noticable charge of num _ extend to num _ num hours .,1,most operations there is a noticable delay lag of num_extend to num_num seconds .
126,0,there was none at all to indicate that belkin used this product .,1,there was nothing at all to indicate that belkin manufactured this item .
127,0,"my girl wanted this for her phone , so we got it for her .",1,"my little girl wanted this for her birthday , so we got it ."
128,0,this phone is from a decade ago .,1,this meter is technology from a decade ago .
129,0,i like this case because of lack of fabric material .,1,i do not like this belt because of lack of material .
130,0,small and does the job quality i expected .,1,too small and not the quality i expected .
131,0,it holds it around until the water evaporates into the air .,1,it just smears it around until the water evaporates into the air .
132,0,i bought this item based on reviews from others .,1,i purchased this based on rave reviews from others .
133,0,i guess maybe there are some people that this could be useful for .,1,i guess maybe there are some people that this product could help .
134,0,sliced perfectly in lieu of french toast on a fruit and cheese plate .,1,with sliced cheese in lieu of french bread on a fruit and cheese plate .
135,0,it didn t have the power a lot of times though .,1,it didn t have the smell a lot complained of though .
136,0,i have been using it twice a day since i use it .,1,i have been using it twice a day since i received it .
137,0,i put one in a password but won t use it .,1,i put in a password but router won t recoginize it .
138,0,"however , the handles are so thin that it gives me a headache .",1,"worse , the controls are so confusing that it gives me a headache ."
139,0,now i have a set that i don t ever want to lose .,1,now i have a game that i don t ever want to play .
140,0,works great knows how to design a very good knife .,1,nokia knows how to design a very good interface .
141,0,"basically , this is a great value on consumers .",1,"basically , this product is a ripoff on consumers ."
142,0,this is honestly the only case i ve put away in the dishwasher .,1,this is honestly the only case i ve thrown away in the garbage .
143,0,i ve had many phones and this one might be the best .,1,i ve had many lighters and this one might be the best .
144,0,its great that its made in rather than china .,1,its good that its made in canada rather than china .
145,0,this is no match for the new iphone .,1,this machine is no match for the new consoles .
146,0,i contacted the company and they said that the phone had been damaged .,1,i contacted the company and they said that the shipment had been lost .
147,0,it s the best headset that drives multiplay into the ground .,1,it s the lame players that drives halo multiplay into the ground .
148,0,for one day only . and opi test this product for animals .,1,good for one day only . and opi test this product on animals .
149,0,"first of all , don t run , it doesn t ooze .",1,"first of all , syrup shouldn t run , it should ooze ."
150,0,"also it gets very plugged in , which allows me to hear better .",1,"also it gets very hot while plugged in , which freaked me out ."
151,0,great product but from what i ve heard it does the job .,1,returned product but from what i ve heard it does the job .
152,0,drinking the water was slightly less than the recommended water it would be .,1,drinking the coffee was slightly less unpleasent than the smell suggested it would be .
153,0,it is easier then no lube because it sooooo works .,1,it is worse then no lube because it gets soooo sticky .
154,0,great for birds or squirrels . num _ num kinds of bird .,1,birds or squirrels . tried num_num different kinds of bird food .
155,0,"however , definitely not like a new phone charger .",1,"however , definitely does not work like a new battery ."
156,0,"what a great product ! learn from my mistake , do .",1,"what a ripoff ! learn from my mistake , do not buy ."
157,0,and still the quality was extremely good or just plain .,1,and still the focus was extremely soft or just plain terrible .
158,0,i also use a cheaper brand of rubber on rubber broad handles .,1,i also tried a cheaper brand of slip on rubber broad heads .
159,0,other brands in this size of a container are great .,1,other brands in this large of a container are glass .
160,0,"yes , they are sturdy , and are sturdy at all times .",1,"yes , they are light , and are not durable at all ."
161,0,she should have her carrying case for herself .,1,she could have decorated her carrying case herself .
162,0,there are companies that make dog biscuits with the lid in it first .,1,there are companies that make dog biscuits with the activated charcoal in it .
163,0,i ve learned that make degrees of coffee .,1,i ve learned that companies make varying degrees of quality .
164,0,"thought , hey why not try different sizes .",1,"thought , hey why not try something different might work ."
165,0,samsung isn t a religion and these are not holy icons .,1,audio isn t a religion and these are not holy water .
166,0,the pan is nong shim shin shin noodle ramyun .,1,the real thing is nong shim shin noodle ramyun .
167,0,this just doesn t have enough room to fit my phone and neck .,1,this just doesn t have enough power to massage my shoulders and neck .
168,0,with a couple of bucks you could buy something a lot more for yourself .,1,with a couple of bucks you could make something a lot better yourself .
169,0,i had much better luck with the other three pans mentioned .,1,i had much better luck with the other three pairs mentioned .
170,0,it s like i got an extension cord and male voice on both ends .,1,it s like i got an extension cord and male outlets on both ends .
171,0,the bowl is perfect for us even had it on a rubber mat .,1,the bowl is too light we even had it on a rubber mat .
172,0,"will buy more in over time though , it s great .",1,"will break in over time though , it s rubber ."
173,0,it is so easy . get a racket ball . this by itself by hand .,1,it is so small . get a racket ball . pass this one by .
174,0,that is not to say that these are made by any means .,1,that is not to say that these treats are bad by any means .
175,0,the buttons seem to reset the phone exactly one time before breaking .,1,the buttons to extend the arms worked exactly one time before breaking .
176,0,i m sure it would last on your age and type .,1,i m sure it depends on your age and body type .
177,0,the strength on this iphone num _ extend is pretty strong .,1,the transmit strength on this compact num_extend is pretty strong .
178,0,"generally if a phone makes noise , i don t so much complain .",1,"generally if a toy makes noise , i don t mind so much ."
179,0,there was almost no dust i liked about this .,1,there was almost nothing i liked about this product .
180,0,i use the phone for five days straight before running out .,1,i used the product for five days straight before running out .
181,0,so i guess it s really a lot of work .,1,so i guess it s really a matter of preference .
182,0,"first of all , this item will work whatever you have with .",1,"first of all , this will void whatever warranty you have with microsoft ."
183,0,and it is very nice that these are good grips .,1,and it is very possible that these are good cables .
184,0,the battery life is great after only a month of owning the case .,1,the bottom part is stretching after only a month of owning the case .
185,0,but it didn t do anything for my iphone .,1,but it didn t do anything for my face .
186,0,i got this for my iphone num _ num year old for christmas .,1,i got this for my num_num month old daughter for christmas .
187,0,"they come in it about a week , if that .",1,"they pee in it about once a week , if that ."
188,0,i only ordered one here because they were alot cheaper .,1,i only ordered on here because they were alot cheaper .
189,0,insert the micro usb charger to your phone and your widescreen display .,1,insert the micro usb to your phone and enjoy your widescreen display .
190,0,"to credit , this one was a bit fun .",1,"to ataris credit , this game was a bit fun ."
191,0,i say this for a guy with fairly good hearing too .,1,i say this as a guy with fairly thin wrists too .
192,0,trying to figure out to a different screen turns it off .,1,trying to slide to a different screen instantly turns it back off .
193,0,it does not disappoint or exciting and it s durable .,1,it not educational or exciting and it s annoying .
194,0,i spent $ on the iphone num _ extend and overall it was worth the cost .,1,i spent $ for the num_extend and overall it was not worth the cost .
195,0,im num _ num gem in quality at least a num _ num inch .,1,im thinking num_num gem stones in at least a num_num inch wheel .
196,0,i use a creamy butter on it .,1,i can use a creamy concealer on it .
197,0,works great on what otherwise has been a reliable company with several different products .,1,shame on what otherwise has been a reliable company with several other respectful products .
198,0,my husband said it was so heavy i had to replace it .,1,my husband said it was obvious so i had to return it .
199,0,is very easy to clean especially with an extended magazine .,1,speedloader is very hard to use especially with an extended magazine .
200,0,mind you the xoom is not that big at all .,1,mind you the oem xoom charger is not like that at all .
201,0,"great for the price tag , its about right .",1,"for the price tag , its nothing to rave about ."
202,0,i mean she can fall apart she can fall down in a hundred pieces .,1,i mean she felt apart she broked down in a hundred pieces .
203,0,i had to go out on the road to get one .,1,i had to buy one out on the road .
204,0,this particular case is rather lacking in the best department .,1,this particular variety is rather lacking in the flavor department .
205,0,"i m tired of cheaply made products , priced .",1,"i m tired of cheaply made , high priced appliances ."
206,0,i won t use this for the new puppy i m getting .,1,i won t give this to the new puppy i m getting .
207,0,"i bought this pan and fried potatoes , and fried eggs perfectly .",1,"i bought this skillet for steaks and fried potatoes , and fried eggs ."
208,0,note that i got one from an amazon store called otterbox .,1,note that i got mine from an amazon store called small appliance .
209,0,i practically felt like i gave away my money on this one .,1,i practically felt like i threw away my money on this one .
210,0,it just broke in half and some fine fitting screws .,1,maybe it just needs broken in and some fine fitting .
211,0,"after four months of that , i gave up and bought it .",1,"after four days of that , i gave up and chucked it ."
212,0,in num _ num minutes num _ extend thq came with this charger .,1,in num_num thq came out with this wrestling game .
213,0,i can t have enough of them to last .,1,i didn t have enough of them to return .
