id,target,s_label,t_label,source
438,the quality of the stainless steel is great .,0,1,it is too bad because the ingredients looked to be quality .
439,i received this today and received it today for a few days .,0,1,i wore this product today for a few hours today .
440,the sliding feature allows you to control the volume control on your hands .,0,1,the feel of the wheel is nice and i like the side scrolling feature .
441,this is a num_extend mah battery for my iphone num_extend,0,1,a definite num_extend for how they handled this .
442,i love these glasses and they are very comfortable .,0,1,am very disappointed that i still can t wear my shoes ! .
443,"it fits perfectly in the sink , which is a nice size .",0,1,"it didn t fit in my bathtub , which is a standard size ."
444,this is the best bluetooth headset i have ever had around my house .,0,1,we plugged in an extra headset laying around the house .
445,it is a nice case that looks good .,0,1,this case looks nice but that s about it .
446,it takes several passes through some types of hair to cut it .,0,1,it takes several passes through some types of hair to cut it .
447,i recently replaced the phone with my cell phone .,0,1,i contacted q cell and they replaced the back cover .
448,i think this will be a good choice .,0,1,i hope it will be a better choice .
449,i love that it makes cooking ingredients on the stove .,0,1,i love that it uses natural ingredients but it was ineffective on my skin .
450,i will try to give this product a try .,0,1,after a num_extend try i received the same product .
451,i have been using my foodsaver products for years .,0,1,most products are for dandruff caused by dry scalp .
452,i have had this over over num_num years and love it .,0,1,over and over and over and over again .
453,this product arrived in good condition and arrived in perfect condition .,0,1,this product was not in functioning condition when delivered .
454,this is a great item that makes no sense at all .,0,1,this is a worthless item that makes no sense at all .
455,worked best on older new england house with narrow staircase .,0,1,worked best on older new england house with narrow staircase .
456,"others seem to work well for others , but i don t have any problems .",0,1,"might work for others , didn t work for me ."
457,it protects my screen perfectly and does not remove the screen protector .,0,1,not to mention it did not fit my screen completely .
458,i love that the possibilities are endless and the possibilities are endless .,0,1,i thought that all of the possibilities would be awesome .
459,it produces mashed potatoes and potatoes and potatoes .,0,1,it was all potatoes and had very little clam flavor .
460,i love the design of the design .,0,1,taking it out of the box i found the design to be awkward .
461,i purchased this jawbone hd as a replacement for an older jawbone thinker .,0,1,i purchased this jawbone hd as a replacement for an older jawbone thinker .
462,i do wish it takes a lifetime to write the word .,0,1,i reported it havent heard a word about it .
463,i bought this as a replacement from amazon .,0,1,i was hoping for a bit better than this from amazon .
464,the only thing i like about this case is the case .,0,1,this case is cute however the is the only good thing about it .
465,i ve had my money saver for the past two years .,0,1,i ve come to the conclusion that i ve wasted my money .
466,i would recommend this to anyone with a samsung galaxy phone .,0,1,"i would not recomend this for a tmobile , mytouch phone to anyone ."
467,i have two of these bowls in the freezer .,0,1,the good pieces that i manages to salvage the birds refuse to touch .
468,this is one of those things that she loves to eat .,0,1,"he enjoys this toy , but can get the treats out fairly quickly ."
469,i like how many times i have used them .,0,1,like how many times you face the nazgul and how easily they are beaten .
470,i have a num_num quart dutch oven for num_num years .,0,1,i ordered num_num and find this to be a hugh mistake .
471,"if you are looking for food prep items , this is it .",0,1,"if you are grinding dry items , it should be ok ."
472,it fits nicely in the palm of my hand .,0,1,the entire thing fits in the palm of my child s hand .
473,i ordered these from amazon since i could find them nowhere in my area .,0,1,i ordered these from amazon since i could find them nowhere in my area .
474,u get what u pay for in the u . s .,0,1,so what it comes down to is that u get what u paid for .
475,i ll stick with my non stick spray pan .,0,1,the balm is crap more like a vaseline stick .
476,i guess it fails in the truth department on its advertising .,0,1,i guess it fails in the truth department on its advertising .
477,this is a great case for my iphone num_extend,0,1,"in this case , it s a big disappointment for num_extend"
478,i use them all the time on the stovetop .,0,1,i bought this product for feeding my num_num persian cats while on vacation .
479,it has a very high quality heating element .,0,1,it is a poor performer when it comes to odor retention and clumping .
480,the photos are great and the photos are great .,0,1,"do not buy this product ! the photos are horribly , horribly misleading ."
481,it s a great size for the iphone num_extend,0,1,it adds size o an already pretty big system .
482,i would recommend this to the lg optimus hero .,0,1,armada lacks the epic scope of similar games like homeworld or even starcraft .
483,they are the perfect size and fit well .,0,1,"they were huge , yet the same size in the leather is tight ."
484,they also make noise if you happen to touch one against the other .,0,1,they also make noise if you happen to touch one against the other .
485,i ve had it for a couple of weeks now and it works great .,0,1,it worked great for the first couple of weeks then it just stopped completely .
486,the legs are tapered and fit nicely under my num_num honda civic .,0,1,spend the extra bucks and get the chopat knee bands .
487,"i use this phone for my blackberry torch , not my blackberry playbook .",0,1,"unfortunately , not my blackberry nor my cell phone ."
488,i contacted the seller and asked for a replacement .,0,1,i contacted the seller and was given a refund .
489,the newer version is better than the older version .,0,1,the graphics are most definitely improved over the previous version .
490,it gets the job done and is a lifesaver .,0,1,it was almost like pokemon yellow in the fighting system .
491,it is light weight and easy to wear .,0,1,it does this to a very significant degree and is extremely uncomfortable to wear .
492,the motor is an excellent motor that has held up well .,0,1,there must be an engineering issue with the motor of the toy .
493,the heat distribution is high quality and distributes heat evenly .,0,1,the quality is declined quickly by heat exposure .
494,i love the flavor of this coffee maker .,0,1,the main flavor to come through is cinnamon and the slight sweetness of stevia .
495,the batteries are fully charged when i charge it .,0,1,i was also very disappointed at how quickly it drains the batteries .
496,i chose it to allow me to meet the requirements in my current apartment .,0,1,i can not send it back due to shipping requirements .
497,i like the clock on my iphone num_extend,0,1,as the clock clicked by num_extend i still felt sluggish .
498,"it s a <UNK> , <UNK> , and the pour spout in the bottom of the pot .",0,1,"ekobrew , the coffee always stays in that bottom wedge section ."
499,i love it and can t wait to replace it .,0,1,i can t send it back again because i don t have it .
500,i ve read digital thermometers before using this thermometer .,1,0,i ve had this thermometer for about num_num years .
501,this review seems to be a common problem .,1,0,will update this review should it meet a similar fate to my previous wheel .
502,this product does not do what it claims to do .,1,0,this product does what it is suppose to do .
503,i checked the hoya filter num_extend uv filter .,1,0,i purchased this filter for a braun num_extend coffeemaker .
504,"this was a good game , but less than half the price .",1,0,very good price but this one harder to use than my cusinart .
505,"to me , this game is so bad . . . . . . . . . . . .",1,0,"so , to me this is pretty darn instant ."
506,the pampered chef s pampered chef french press is a disaster .,1,0,replaced my pampered chef garlic press with this one .
507,i bought this router at a local office supply store .,1,0,i use this as a little office supply shelf .
508,the quality of these products are similar to apple products .,1,0,durable and seems similar quality to apple products .
509,i ve always been disappointed with hanes products .,1,0,"i have many oxo products , and i ve always been pleased ."
510,"also , i noticed the thickness of the blade was <UNK> .",1,0,i also prefered the blade weight and thickness of the wustof .
511,the contacts will not line up to the bottom of the contacts .,1,0,make sure the pins line up with the contacts .
512,maybe i just got lucky to replace it .,1,0,it turned out just fine to replace what i had lost .
513,i would prefer to get the balls out of the way .,1,0,love the way these roll instead of sliding on the rod .
514,i was disappointed at how well this product arrived .,1,0,product arrived on time and was wrapped well .
515,i ended up throwing them in the trash .,1,0,they pile up nice in the closet and clean up great in the dishwasher .
516,i guess i ll give it a second time .,1,0,i had it a long time now and i still love it .
517,i really didnt like the protection of the game .,1,0,this offers really good protection for the phone .
518,this is one of the worst games i ve ever seen .,1,0,this is one of the best vacuums i ve ever come across .
519,it takes a minute to get the desired leverage .,1,0,one minute per slice seems like a good rule of thumb so far .
520,the only reason i gave it num_num stars is that the cats were not interested .,1,0,i would have given this five stars except for the only complaint i had .
521,the non stick coating is the metal coating .,1,0,the metal is very sturdy and the non stick finish is great .
522,"also , the flap does not come undone at all .",1,0,the flap also is good and does not come loose at all .
523,the cut scenes make your nails look sharp .,1,0,sharp cutting edges make your pies look as good as they taste .
524,i am a female female female female female terrier .,1,0,"i m a male , a bachelor who lives alone ."
525,i ended up throwing the bottom line into the trash .,1,0,recently threw in the trash as the line wore out .
526,"i wish i could return these , but i m returning them .",1,0,"i have several of these , well worth it ."
527,i would not recommend this product to anyone .,1,0,i would recommend to anyone who wants a pda .
528,i was suckered in the market on the market .,1,0,i believe it was about $ when it came to market .
529,there are better options out there for this game .,1,0,"great charger , though there may be cheaper options ."
530,the only thing i like about it is the smell .,1,0,the whole thing gets hot when you use it .
531,"after a while , the game was not worth it .",1,0,so shipping takes a while but it is definitely worth the price .
532,these are my favorite sheets of cookie sheets .,1,0,"blocking the red hot coils from my cookie sheets , and glassware ."
533,the range is decent and the range range is decent .,1,0,the sound range and loudness is pretty impressive for the price and size .
534,you can t mix anything else or anything else .,1,0,"great for about anything you want to shred , cut or mix ."
535,"order it with something else , and you ll get free shipping .",1,0,"order it with something else , and you ll get free shipping ."
536,i don t think these weights contain latex weights .,1,0,i don t think pie weights are for me .
537,the head head is a joke for me .,1,0,the head set is quite comfortable at least for me .
538,"after a minute , it was just a pain .",1,0,washing it is a breeze and just takes a second .
539,"once glitch , which i did not view as all that negative .",1,0,"once glitch , which i did not view as all that negative ."
540,i had this bike mount for about num_num months .,1,0,i have had this mount for about a year and it works great .
541,this happened after about num_num years of use .,1,0,this happened after about num_num years of use .
542,"but it s not bad for wireless , i ve had worse .",1,0,"but it s not bad for wireless , i ve had worse ."
543,i guess i could get the router at the same time .,1,0,exactly what i need for my phone and at the best price possible .
544,within a few days of <UNK> my mailbox were canceled .,1,0,shipped free directly from realook and arrived within two days .
545,"during the winter of ants , the forest appeared to unravel .",1,0,i of course treated it with a wood sealant to last through the winter .
546,i had no idea how to put them on .,1,0,easy to put on and i have no problems .
547,i keep the fish moist and dry it .,1,0,i think that is the way to keep the fish moist .
548,it s just not a deal breaker for me .,1,0,it was just one and that s not a big deal .
549,i didn t notice the coating flaking off after i started eating .,1,0,i haven t had any problems with teflon flaking off .
550,i wish i had a small head head head .,1,0,i only wish the vacuum head was a little larger .
551,amazon was selling this item at amazon on amazon . com .,1,0,this one is available at a decent price with fair shipping here on amazon .
552,i like the <UNK> of acai juice <UNK> .,1,0,i like almost everything except cucumber juice echhh .
553,the main problem is that the brush heads kept falling off .,1,0,one great feature is that the spatula head is removable for east cleaning .
554,"num_num hours later , the auto shutoff feature is <UNK> .",1,0,"auto shut off after num_num hours , which is a good feature ."
555,after a few days of opening the bottle they shrunk .,1,0,"even after several days , they are air tight in a wine bottle ."
556,i ordered num_num of these in the past num_num months .,1,0,i bought this in num_num and the pan is still in great shape .
557,there are several <UNK> of <UNK> and <UNK> <UNK> .,1,0,these come in handy with those tender special moments and celebrations .
558,it is too small and not too heavy .,1,0,and yet it is compact and not too heavy .
559,i read the measurements closely and ordered two of them .,1,0,both english and metric measurements are embossed onto each spoon .
560,i ll give it num_num stars for the taste .,1,0,and it ll keep rice perfect and hot for up to num_num hours .
561,the copper coating appears to be coated with a copper coating .,1,0,the copper finish is coated with a clear plastic to prevent oxidation .
562,the smell is overpowering and the smell lingers after a while .,1,0,it keeps the air clean and nice fresh smelling .
563,the belt clip ripped off within a few minutes .,1,0,belt works fine and installed in just a few minutes .
564,obviously the margin of safety from overflow is much smaller .,1,0,obviously the margin of safety from overflow is much smaller .
565,i ordered two of these pieces before buying them .,1,0,i paid $ for this when i bought a few other pieces .
566,"shipping was fast , so i returned it for the refund .",1,0,i would buy again if the shipping wasnt so long .
567,it did not last a long time or so .,1,0,so far has lasted for a long time and does not wear off .
568,thank goodness i could give them a try .,1,0,they were awesome and they work great i like them a lot thank you .
569,the only thing i can say is that it is not coming apart .,1,0,the only thing is it stretches easily so be careful with that .
570,you can not line the line of line on the line of this line .,1,0,this will compete with any top of the line knife you can buy .
571,dash mounts are either bulky and in the way or not strong enough .,1,0,dash mounts are either bulky and in the way or not strong enough .
572,the cardboard box ripped off within num_num days .,1,0,i bought this protective cover case for num_num cents plus shipping .
573,my guinea pig door door door door door door door door .,1,0,mine fit perfectly on my linen closet door with no securing necessary .
574,there are a variety of sizes with different sizes .,1,0,very sturdy with a good selection of teeth sizes .
575,i never had a problem with any of them .,1,0,"i use it a lot , and it never gave me any problem ."
576,it s a bit louder than i thought it would be .,1,0,it s more powerful so i expect it to be a little louder .
577,the straps are slightly <UNK> in the head .,1,0,the handle is comfortable and holds the pitchers securely in your hands .
578,"that said , the mic did pic up everything it could .",1,0,"that said , the mic did pic up everything it could ."
579,within num_num minutes the hose froze up in the freezer .,1,0,i just bought a num_extend cubic ft chest freezer .
580,the pictures are not bright or bright pictures .,1,0,there are num_num bright leds for taking pictures or just as a flashlight .
581,<UNK> <UNK> <UNK> <UNK> <UNK> <UNK> <UNK> <UNK> <UNK> .,1,0,no more oil on my hands when cooking up a steak or falafel .
582,i am very disappointed with it and i would not buy it again .,1,0,it works great and i am very happy with it .
583,the shipping charges are now lower and upfront on the order .,1,0,the shipping charges are now lower and upfront on the order .
584,num_extend num_extend num_extend num_extend num_extend num_extend num_extend num_extend num_extend num_extend num_extend,1,0,i bought it for a new iphone num_extend
585,i couldn t taste ice cream in the ice cream .,1,0,i can t believe how beautiful and substantial this ice cream maker is .
586,i ve had this shaver for about a year .,1,0,i used a blade grinder for years before buying a burr grinder .
587,i will not buy another one of this game .,1,0,this one does the job i need it for ! .
588,i didn t add much bulk to the defender series .,1,0,i don t want the bulk of an otterbox defender .
589,i ended up returning the linksys wireless router .,1,0,the charger is working with my wireless bluetooth speaker just fine so far .
590,the sound quality is worse than the graphics .,1,0,although once you go a little past halfway the quality gets a little worse .
591,i m starting to hate it because i don t need to upgrade .,1,0,i m starting to hate it because i don t need to upgrade .
592,i guess that s what i m thinking about .,1,0,i guess you could say so what it s a ladle .
593,i d rather get a better immersion blender than this one .,1,0,fast; better than a blender and is easy to use .
594,"i would buy them again , but i would not buy them again .",1,0,"overall i love them , and would probably buy them again ."
595,i tried several different locations in the house .,1,0,i have two of them in different locations in my house .
596,the voice from the earpiece says connected on successful completion .,1,0,the voice from the earpiece says connected on successful completion .
597,i followed the instructions and followed the instructions .,1,0,they come with full instructions and not much more to say .
598,i had to go back to them for a refund .,1,0,went looking for them and you had them .
599,i am very disappointed with this purchase and would not purchase again .,1,0,i have been extremely happy with my purchase .
600,"the glass lids were horrible , they leaked everywhere .",1,0,the glass cuisinart lids would pour water everywhere in a wet mess .
601,i wish i had spent a lot of money .,1,0,i am glad that i did not spend a fortune on the electric models .
602,the rack sits on top of the rack .,1,0,it s very simple and takes up very little space on the pot rack .
603,the water was way too hot to go in the bottle .,1,0,"fill the pan half way with water , and put it to boil ."
604,i had to pull the mouse off the side of the lens .,1,0,comes with a towel to clean the phone before placement .
605,i had to return the battery to see if the battery was shorted out .,1,0,no battery to wear out and have to replace .
606,"i thought they were ok , but i did not like them .",1,0,"like i said , it works , these are ok ."
607,the game does not get the job done .,1,0,this gets the job done for the price .
608,maybe it was working for my cat s eczema .,1,0,seems to working fine in my mother s humidifier .
609,i followed the directions and saw the results .,1,0,mediocre results until hitting upon a great cookbook .
610,it did not work right through the trouble .,1,0,it pushed right through the job with no trouble .
611,it s hard to push the power button or something else .,1,0,on the other hand for power grating you ve got something here .
612,the sticker on the film appears to remove the film .,1,0,the remaining sticker is attached to the second film .
613,i will not waste my money on these again .,1,0,i use it for my line of work and it stands up .
614,"it was light and fluffy , and the flavor was overpowering .",1,0,the cheese came out light and fluffy wished i had had one earlier .
615,the build quality of the wind waker is poor .,1,0,"great headset , solid build quality and blocks out the wind ."
616,the indicator lights indicator lights indicate the indicator light indicating the internal light of the unit .,1,0,"for example , the box says there s an led battery indicator light ."
617,"in fact , the corner of the lens is slightly raised .",1,0,one corner is slightly taller than the other but its hardly noticeable .
618,i am so glad i bought this one .,1,0,i am so glad we chose this one .
619,i did alot of research before buying these .,1,0,we use these alot and they work great .
620,"i say that after trying many cheap pathetic headsets , sigh .",1,0,"i say that after trying many cheap pathetic headsets , sigh ."
621,i pretreated the worst stains withwoolite pet stain .,1,0,i pretreated the worst stains withwoolite pet stain .
622,i dropped the floor onto the floor floor .,1,0,i have dropped the phone onto a tile floor and it is fine .
623,the la prima ran about half a shot then choked the machine .,1,0,the la prima ran about half a shot then choked the machine .
624,"after about num_num hours of usage , the battery level began to be noticeably distorted .",1,0,with medium usage its closer to about num_num hours .
625,the level lights up to num_num hours of level .,1,0,there are num_num blue lights to indicate the level of the unit s charge .
626,the bottom of the container is not lined up .,1,0,the bottom most container is not as small as one would think .
627,it does not do what it says it does .,1,0,that s what it does and it does it well .
628,<UNK> es <UNK> que los <UNK> que <UNK> que <UNK> <UNK> <UNK> en los <UNK> .,1,0,recomiendo este vendedor porque tengo total seguridad que es una bella y honesta persona .
629,"of course , this game is an example of the premise of the game .",1,0,"however , this is an example of how rosle got it right ."
630,"however , it lacks the appearance of the universe .",1,0,"it fulfills my modest requirements , and exceeds my expectations in appearance ."
631,some reviewers complained of grounds in the coffee .,1,0,some reviewers complained of grounds in the coffee .
632,i had ants flying around the house of my house .,1,0,i had installed two of these for the front entrance of our house .
633,you ll see how much movement you want in the game .,1,0,look up videos on swype if you want to see it in action .
634,i like the fact that this perfume is washable .,1,0,i like that is is durable and washable .
635,"after less than num_num years , the plastic ones are coming out of the kennel .",1,0,the aluminum ones get stained and ugly after a few uses .
636,i was suffering from the <UNK> steam cleaner .,1,0,i was torn between ordering the wagner steam cleaner and this mcculloch steam cleaner .
637,not worth the amount of money to return .,1,0,adds some bulk to phone but not a large amount .
638,the door door door refused to stay closed .,1,0,place it in the freezer and close the door .
639,the legs are very flimsy and take care of them .,1,0,open carefully and handle the zippers with care .
640,i returned this product and got a refund .,1,0,it had a great cost and a great product .
641,"instead of opening the feeder , you have to throw the feeder into the bowl .",1,0,you do have to hold a bowl when catching the meat you re grinding .
642,most of the time you have a <UNK> type of <UNK> <UNK> .,1,0,these type honeywells have been around a long time .
643,i would not recommend this piece of junk .,1,0,i have had no problem with either piece and highly recommend the products .
644,it is very uncomfortable and will not stay in place .,1,0,it stays stable in your ear very nicely and is surprisingly very comfortable .
645,do not buy this bell peanut butter bell .,1,0,this little butter bell is a fantastic buy .
646,"the sound quality is terrible , the sound quality is terrible .",1,0,"this headset is awesome , the sound quality is truly amazing ."
647,the packaging was wrapped in cardboard wrap free packaging .,1,0,i would have given a five star if the packaging with some bubble wrap .
648,there is nothing special about this game at all .,1,0,nothing bad to say about this wonderful innovation at all .
649,urine stains did not collect food from feces .,1,0,it stay clean and does not collect food stains .
650,no way to send the phone back to the blackberry .,1,0,i never have problems answering the phone this way with my blackberry .
651,it was very difficult to apply and apply .,1,0,easy to apply and it works very well .
652,i tried this out of desperation when i first got it .,1,0,i wore my first one out by pouring hot gravies in it .
653,i don t even want to change my lenses .,1,0,"also , don t use that yellow cloth to clean your phone ."
654,i could not stand the cord to the cord .,1,0,the cord is extra heavy to resist tangling .
