id,target,s_label,t_label,source
655,i purchased these batteries based on the reviews of others .,1,0,i purchased these batteries based on the reviews of others .
656,it doesn t seem to affect any of the blackheads .,1,0,doesn t really reduce the fat anymore than most cooking methods .
657,i have nothing else to say about this game .,1,0,it is hard to go to anything else now that i have used this .
658,i agree with the fact that it s a <UNK> game .,1,0,the cookbook that comes with it is adequate .
659,"after num_num hours of playing , i m still awake .",1,0,sometimes i m there for up to num_num hours .
660,apparently the warranty expired warranty expired warranty expired .,1,0,it has a num_num year warranty on defects too .
661,the cover does not cover what is supposed to do .,1,0,this cover does exactly what it is designed to do .
662,you have to manually select various locations where you need to access the buildings .,1,0,easily moved to various locations depending on need .
663,i have read reviews from wine experts that it doesn t work .,1,0,i have read reviews from wine experts that it doesn t work .
664,the part part of the screen protector is not smooth .,1,0,and do not remove part one of the screen until part two is applied .
665,coffee makers are the worst tasting coffee maker .,1,0,i would have hated to put disposable filters every time when using coffee maker .
666,update : update june num_extend num_extend num_extend firmware update .,1,0,when purchased i discovered there was a newer product update : model num_extend
667,i decided to give this chance a chance .,1,0,i just got this and recently got a chance to use it .
668,i was so excited to try this mouse .,1,0,then along came this zester which i use constantly .
669,i purchased it from one of the first infomercials .,1,0,i purchased it from one of the first infomercials .
670,"i like the size of this bra , but i can not use it .",1,0,i recommand smaller size for everyday use . but i like this pan .
671,there are much better choices out of the box .,1,0,"toasts bread , muffins and bagels with lots of options to choose ."
672,my golden retriever is african american and <UNK> .,1,0,tastes in between the classic american blonde ale and cowboy golden lager .
673,these were the worse screen protectors i ve ordered .,1,0,i purchased the screen protectors for my evo .
674,"tonight , i shredded my homemade almond sauce and tomato sauce .",1,0,put homemade pizza sauce on top then add pepperoni and fresh mushrooms .
675,this filter leaked water in the water tank .,1,0,this is the old faithful water filter pitcher .
676,i will not be ordering another invicta in the future .,1,0,i shall be ordering a second one in the not too distant future .
677,"if the material was slightly thicker , it would be num_num stars because of the material .",1,0,would be five stars if it was out of slightly heavier material .
678,"after the first rise of bread , the bread refused to rise .",1,0,we use a bread machine to prepare the dough and provide the first rise .
679,i ve never been disappointed with hanes products .,1,0,i ve been happy with most oxo products i ve purchased .
680,"next morning , i woke up to the next morning .",1,0,"it s good to go the next morning , completely clean ."
681,this is a major problem with the <UNK> <UNK> .,1,0,"other than that small problem , this is a great bt headdest ."
682,i followed the instructions and threw away the first num_num batches of coffee .,1,0,i followed the instructions and threw away the first num_num batches of coffee .
683,the <UNK> <UNK> <UNK> <UNK> <UNK> <UNK> <UNK> <UNK> .,1,0,loved the deffender case hated the apple phone .
684,at least point the point that you can t attach it to the point .,1,0,it can t be tightened at that point to fix it .
685,i wore them in the gym at night .,1,0,wrapped around me easily to tuck in for getting ready at the gym .
686,you have to sharpen a diamond knife sharpener .,1,0,so i purchased another knife sharpener for this our num_num yankee swap .
687,the controls are impossible to release the blade .,1,0,blade release buttons are simple to use which makes cleaning easy .
688,"the first time i ordered it , i was disappointed .",1,0,i ordered it and it was delivered well in time .
689,i bought this as a gift for my brother .,1,0,i bought this is a gift for my brother .
690,"in my opinion , there is a limited percentage of bait .",1,0,: pi also have limited space in my kitchen .
691,i d try something else if i could find something better .,1,0,wish it had a crank or something to make it easier .
692,"after repeated cleanings , the bosses do not maintain the cleaning process .",1,0,"maintenance cleaning is fast , neglected cleaning takes more time and repeated cleanings ."
693,"when i opened the jar , i noticed that the plastic container was made of plastic .",1,0,i also love it because the jar is plastic .
694,"as stated by the many reviews , this is an exceptinal carpet cleaner .",1,0,"as stated by the many reviews , this is an exceptinal carpet cleaner ."
695,"instead of eating peanuts or fruit bars , you are <UNK> .",1,0,delicious over fruit and kashii go lean crunch cereal .
696,i ll probably never buy a women s cast iron .,1,0,you ve probably seen them use it on iron chef .
697,i bought two of these batteries from <UNK> inc .,1,0,i think that dsp manager is the stock one for android phones .
698,i was so excited to get this knife .,1,0,i purchased this to replace a knife that was lost .
699,"maybe it would have been a bit bigger , but it was a bit smaller .",1,0,it would have been perfect if it was a tad bit smaller .
700,i had to go through the game to get it to work .,1,0,all came well sharpened and ready to go .
701,i opened cans of cans for num_num cans .,1,0,i have had two of these cans outside for over a year .
702,don t waste your money on this <UNK> <UNK> .,1,0,this cuts down on waste and you don t have to ingest harmful propellants .
703,i ve tried the pulls with prongs that go along side the cork .,1,0,i ve tried the pulls with prongs that go along side the cork .
704,these games are much more fun with this game .,1,0,games like gem journey are easier to play with a stylus like this .
705,"if you have more than num_num cats , i would have to go back to this one .",1,0,it is great if you have more than one guest to serve .
706,i tested it out in the <UNK> <UNK> .,1,0,i made beef bolognese in the oven and it turned out wonderfully .
707,i got this as a gift for my son .,1,0,i got this as a gift for my son .
708,i have a num_num pound bird feeder that weighs num_num lbs .,1,0,i think this size wont do a bigger bird than num_num pounds .
709,there are a cross cross cross <UNK> and <UNK> <UNK> .,1,0,making seperation and cross contamination containment a very easy .
710,i could not wait to send it back .,1,0,i cannot wait to show it off ! thank you ! .
711,roomba pets don t allow me to enter the monthly beds .,1,0,the roomba just thinks it s furniture and doesn t go up on it .
712,these treats are geared in a stocking stuffer .,1,0,the measuring spoons would make a great stocking stuffer for any kitchen queen .
713,i was excited to try this mouse after reading the reviews .,1,0,the zester was easy enough to clean after use .
714,"i m not happy with this game , but i m returning it .",1,0,"but for now , i m quite happy with this ."
715,"i like the size of this cereal , but they were just too large for me .",1,0,perfect size for preparing dishes . it really works well .
716,i bought this for my num_num year old .,1,0,the last time i did it was a year ago .
717,i can not recommend this product at all .,1,0,this product is being used for dollar size pancakes .
718,i can not get it to fit in my pocket .,1,0,i can carry it in my pocket and use it when i need to .
719,"on the bright side , the green light is very bright .",1,0,the tiny green light on one side is very bright when fully charged .
720,i will write this review in my review .,1,0,apparently there are thirteen more words required to successfully submit this review .
721,i would not turn on the top of the game .,1,0,love it ! really handy to set by the stove .
722,"as far as reliability , the construction is shoddy .",1,0,"adequately long cord . made in china , hence no reliability ."
723,this one does not work well at all .,1,0,but this one does the job very nicely .
724,"i m not a fan of <UNK> games , so i decided to try this game .",1,0,i m a fan of symbian and find it easy to operate .
725,i plugged it into my computer with my computer .,1,0,plugs the ipad into my car and works great .
726,i m not sure why it works as advertised .,1,0,i m convinced vacuum sealing works just as advertised .
727,i wish i could return the other items .,1,0,i like it better than any of the forman items .
728,the first thing i noticed was that the inside of the bag ripped open .,1,0,i use this thing to core out the inside of a potato .
729,i returned the unit and replaced the unit .,1,0,once it dies i will purchase a better unit .
730,"the graphics are blurry , but nothing more than the pictures .",1,0,"otterboxes are a little bulky , but nothing protects better for the price ."
731,the plot is sort of like <UNK> meat .,1,0,this style of meat pounder is sort of commodity like .
732,"after a few hours , you could not turn it back to the max level .",1,0,nice not to have a burner going for hours .
733,i don t know why i didn t even get one of these .,1,0,i can t believe i haven t owned one of these before .
734,i ve never made the mistake with this french press .,1,0,this unit makes the best french fries i ve ever made .
735,maybe the battery was dead when i dropped it .,1,0,it s probably my phone but it happens constantly since i got the battery .
736,"i ve tried all kinds of types of tomatoes , including <UNK> assault .",1,0,"it works with all types , but works best with roma tomatoes ."
737,"the plates are dull , so you could be taken off by the elements .",1,0,careful when using steak knives however because they will scratch these plates .
738,the plates were covered with a paper towel .,1,0,just wipe the plates with a paper towel .
739,i wish i hadn t bought these sooner .,1,0,i can t believe that i didn t buy these sooner .
740,the recipe that came with it is the ingredient .,1,0,the recipe that comes with it is tasty .
741,"maybe it s a fluke , but i m more than num_num lbs .",1,0,"it s still going great , i just needed more capacity ."
742,"however , the length of the game is awkward .",1,0,"also , the knife is easy to maneuver despite its length ."
743,i doubt i will give this game num_num stars .,1,0,i have no doubt that it will hold up well through the years .
744,i rate this game to my num_extend star rating .,1,0,"i had two problems , one caused the rating to num_num num_extend"
745,"when i put it on , it was dead .",1,0,it stays on and i unplug it when it s done .
746,i would not buy this game again if you are a collector .,1,0,"for the price , this is a good buy ."
747,i ve had this game for num_num years .,1,0,i had a less powerful one for num_num years before it finally gave out .
748,there s nothing special about this game at all .,1,0,and it s a bread knife and nothing all that special .
749,there s no way you need to place them in place .,1,0,no need to find storage place because it fits in any shallow drawer .
750,i can t believe i saw another brand of bird feeders .,1,0,i used to use a good cooks brand safety opener and really liked it .
751,i put them in the garbage and then threw them out .,1,0,then both of them go into the dishwasher .
752,i was wrong in the dark brown tanning pan .,1,0,i love my lodge omelet pan and use it almost every morning .
753,"that s about % of the time , but it needs to be recharged .",1,0,"tablets charge slowly , but that s to be expected ."
754,we adopted the transmitter from the transmitter on my porch .,1,0,however signal between transmitter and receiver does not work between insulated patio glass door .
755,i wish i had ordered this bra after num_num or num_num years .,1,0,this pan i have had for one year .
756,i do seem to need to invest in some better popcorn .,1,0,i do seem to need to invest in some better popcorn .
757,i bought this along with the <UNK> of the puzzles .,1,0,bento spoon and the boker knife which is quite nice .
758,"when i first got this game , i was laughing with me .",1,0,really confused ppl riding with me at first .
759,i am glad i did not purchase this .,1,0,i finally made he purchase and am glad i did .
760,"when i first got this game , i couldn t bring it to the timer .",1,0,i can t remember when i first bought this timer .
761,it did not stay in place at all .,1,0,it does not slip all over the place when using .
762,there s no background noise or something like that .,1,0,coming from an asian background it s not something we normally cook with .
763,"first off , the num_extend controller should be labeled num_extend",1,0,it should reconnect easily when you are in the num_extend
764,you have to open the bottle to open the top of the bottle .,1,0,now i just need to buy a catch can for the bottle tops .
765,i have had to replace the paddles as they wore out .,1,0,i have had to replace the paddles as they wore out .
766,i was very disappointed with this purchase .,1,0,i liked this and was happy with my purchase .
767,i consume leafy greens in the garden of garden greens .,1,0,we juiced our garden lettuce and greens with ease .
768,i would not recommend this product for the price .,1,0,anyway i recommend this one for its price and quality .
769,i put my kitchen appliances through the ringer .,1,0,i put my kitchen appliances through the ringer .
770,this is the only one i could ever figure out .,1,0,i have been missing out ! this thing is so sharp .
771,"i hate to describe it , but i hate it .",1,0,"it is easy to clean , but honestly i rarely clean it ."
772,"by the way , i ended up getting a <UNK> brush .",1,0,"hand graters can be a mess to clean , especially under the handle ."
773,"in other words , you ll have to fight the game .",1,0,"you have to break it in , in other words ."
774,amazon prime membership was the prime membership for me .,1,0,"the price was good , and came quickly though my prime membership ."
775,i bought this item for the purpose of returning it .,1,0,for my purpose this is the perfect item .
776,i bought the num_extend version of the nook recorder for my blackberry curve num_extend,1,0,"we both use the blackberry num_num curve , which each use bluetooth version num_extend"
777,i was very excited to receive this case .,1,0,"great case , easy to use and very durable ."
778,this car charger does not work in the car .,1,0,need a cheap car charger and it seems to do the job .
779,i thought i tasted stale or stale . . . . . . . . . . . . .,1,0,i recently purchased white rice popcorn for my dad who has diverticulitious .
780,i have been using it faithfully since i received it .,1,0,have been using it daily since it arrived .
781,i wish i had ordered the wrong size .,1,0,this casserole dish is the perfect size and i love having a nice lid .
782,"if you have large hands , this might be very uncomfortable .",1,0,unless you have very small or very large hands it is comfortable to use .
783,i ordered these round round round round round stakes .,1,0,i have both a square and round pan i use this with .
784,i contacted customer support and spoke with customer support .,1,0,i have never had a pleasant experience with the customer support at cuisnart .
785,"this stuff was nothing special , but the <UNK> was way too much .",1,0,"much to my dismay , the invisishield was nothing but garbage ."
786,i can t sit on top of the stove top .,1,0,we love that it can go straight from the stove top to the oven .
787,it collapses into a powder or powder powder .,1,0,it creates heaping folds of foam andturns your coffee into a breve latte .
788,i noticed that they show some <UNK> on her <UNK> .,1,0,i never thought about making cheese until ree drummond made some on her show .
789,it wasn t even worse than i thought it would be .,1,0,i though it would be faster and easier but it wasn t .
790,the build quality seems to be of poor quality .,1,0,it seems to be of very good quality in its build .
791,"after about num_num hours of listening to wired headsets , i disconnected my radio from the transmitter .",1,0,i have smaller bt headsets that last num_num hours longer .
792,it may be fine if you use it often .,1,0,may be it will become soft with use and then it should be fine .
793,the only thing i ate was the chunks of potato chips .,1,0,it is the handiest thing for slicing potatoes for scalloped potatoes and chips .
794,i ve had this game for nearly num_num years .,1,0,i have been using one for nearly num_num years .
795,i wish i had read the reviews before buying it .,1,0,researched before i bought it and had actually chosen another one .
796,i drank it for hours and hours later .,1,0,it keeps it the coffee hot and fresh for hours .
797,"if you have num_num mg of sodium , i d opt for a num_num oz pot .",1,0,if you need a pot with this capacity num_extend qts buy this one .
798,"i think this is a great product , but i will not be buying more .",1,0,more creative than num_extend dont think so ! but still a great product .
799,"it s just like <UNK> <UNK> <UNK> , <UNK> <UNK> <UNK> .",1,0,"its like that showtime rotisserrie oven , you set it and forget it ."
800,"it s not what you re going to do , so it s a shame .",1,0,"this is what s affordable right now , so it has to do ."
801,i followed the instructions and was hoping for the firewall .,1,0,i followed the guidance and am grateful for it .
802,the coating on the anodized coating is flaking off .,1,0,"in particular , the coating on this cookware has been cheapened ."
803,the fit in the calf openings are incorrect .,1,0,"fits perfectly , cutouts are plsced where they should be ."
804,"i only used it once , so i thought i would return it .",1,0,i ve only charged it once since i bought it .
805,i wish i could return the pad or something .,1,0,i also like the adjustable heat option for the warming plate .
806,i applied screen protectors before applying the screen protector .,1,0,"i still have privacy screen , after num_num months ."
807,"i haven t played it yet , but it wasn t so bad .",1,0,"it it pretty hardy , i haven t broken it yet ."
808,i bought this about num_num months ago and it broke after num_num months .,1,0,i will update my review after num_num months .
809,i bought two of these stakes in anticipation .,1,0,i purchased two to mount horizontally under the shelves of my kitchen island .
810,i donated the grocery store to local grocery store .,1,0,also cheaper than going to the grocery store .
811,i noticed no change in the color of my skin .,1,0,no complaints and my wife loves the color .
812,i read the reviews here before buying this grinder .,1,0,i m not sure why this grinder got so many mixed reviews .
813,i ordered two of these cookie scoops .,1,0,these small cookie scoops made perfectly uniform two inch cookies .
814,the voice actors were the same as the voice actors .,1,0,voice command is better on this set than other ones i ve tried .
815,these tongs are a step backwards to the end of the earring .,1,0,these tongs seem to have the locking mechanism backwards .
816,"for the price , i m not sure why it s worth the money .",1,0,"get it , it s worth the price for sure ."
817,the problem is that the unit doesn t separate the disc either .,1,0,there is no warming plate in the unit but it doesn t need one .
818,there are so many things about this game .,1,0,things i notice so far : + bluetooth num_extend streaming is solid .
819,i would not buy an external usb port .,1,0,i use it charge my batteries since my usb port is not an option .
820,bacteria are <UNK> in the nooks and crannies .,1,0,fasy to keep clean and a real treasure .
821,there is a spout that attaches into the spout of the spout .,1,0,just make sure that you don t misplace the spout stopper .
822,i received these as a christmas present for christmas .,1,0,i received them as a christmas present and i love them .
823,i did not know what it was supposed to do .,1,0,it did what it was supposed to do .
824,i poured the water into the water tank and stirred it .,1,0,put num_num quart of water into the machine .
825,there is no way the cord would fall out of the board .,1,0,this keeps the cord out of the way and above the board .
826,i tried to use it for deep frying .,1,0,i use is for more than deep frying .
827,i wish i d try some of the gluten free flours .,1,0,i sprinkle a little flour on the rolls before stamping to prevent sticking .
828,there was a hole hole on the hole to cut the hole into the hole .,1,0,it was the finger next to his hole finger .
829,i ended up wearing pair of socks in the gym .,1,0,it s almost like putting the phone into a high end pair of socks .
830,the sound quality of these things are terrible .,1,0,we are ice cream lovers and fussy about the quality of ice cream .
831,"also , the pieces are hard to chew together .",1,0,also these attachment pieces are very easy to clean .
832,"within a few days , the <UNK> <UNK> was <UNK> .",1,0,only negative was delifery was num_num days late .
833,i just received a replacement bb curve from verizon .,1,0,i just received a replacement bb curve from verizon .
834,"the graphics are decent , but the battery life is subpar .",1,0,"oh , and the battery life is pretty decent ."
835,i dropped the case once i got it .,1,0,i dropped phone once and the case held up perfectly .
836,i installed the <UNK> window window window window window window .,1,0,i installed this on a horizantaly sliding window .
837,"unfortunately , i couldn t hear the loud buzzing noises .",1,0,"love this mixer , wasn t near as loud as some were saying ."
838,these do not do the job of opening the bottle .,1,0,these wine stoppers are very inexpensive and certainly do the job .
839,you can access access to enemies and aliens .,1,0,it makes it easy and neat to store and access all of your scarves .
840,i m glad i got the cheaper ones out there .,1,0,glad i went for this one over some of the less expensive ones .
841,"half of the time , the results were up .",1,0,cleans up nice and cooks waffles in a reasonable amount of time .
842,the tines are too wide and the tines are irregular .,1,0,short blades and longer handles give you the leverage you need for tough cutting .
843,it was missing all the parts on the site .,1,0,and it s much much cheaper than getting it at the cusinart parts site .
844,then i plugged it back into my computer .,1,0,then into my phone and it chargers my phone .
845,i intend to take advantage on this dvd player .,1,0,"great dutch oven , works well and fun to use on camping trips ."
846,the otterbox defender series series series is far superior .,1,0,the otterbox defender series is by far the best available .
847,i ve had this product for over a year .,1,0,this turner has worked well for the last few years .
848,i installed the mag mount on my phone .,1,0,but i like the phone to be up higher on the windshield . recommended .
849,"on the plus side , these shoes are not sterling silver .",1,0,"heavy , patterned glass , and very classy looking on the table ."
850,i have not been able to stop using it .,1,0,i have not been able to stop using it .
851,"i spent lots of time trying to eat carrots , carrots , carrots , etc .",1,0,"however , slicing up tons of veggies can be quite time consuming ."
852,i didn t even try the <UNK> <UNK> seeds .,1,0,i mainly use my blentec now but haven t sold the vitamix yet .
853,i was glad i had to return it .,1,0,i was glad to see it was still available .
854,"no matter how to apply them , there were no bubbles on them .",1,0,"very easy to put on , no bubbles whatsoever ."
855,i can not see a lot of positive reviews .,1,0,i can see i will be using it a lot .
856,i thought these would be good for the price .,1,0,i was concerned for the price that these measuring cups would be flimsy .
857,the <UNK> of the game was <UNK> <UNK> .,1,0,the complication is the heft of the phone .
858,i have a num_num year old pug that does not work well at all .,1,0,i have owned it for two years and it is a work horse .
859,i bought this dvd player along with a coleman set .,1,0,i used this set with a toaster oven and with a coleman camping oven .
860,i would not buy anything else from this brand .,1,0,i bought the lowest priced model more to test the brand than anything else .
861,i read all the ingredients in this game .,1,0,you place all the ingredients into the bread maker .
862,the gel feels like it was glued to my skin .,1,0,my dish feels very solid to the touch .
863,this is not the case with the num_extend,1,0,this is definitely not the case with the num_extend
864,i don t know how i managed to play without this game .,1,0,i don t know how i ever managed without this handy devise .
865,these are not worth the money i paid for them .,1,0,but these knives are well worth their price .
866,the loops of the belt loops are <UNK> .,1,0,the loops stop any accidently lost or intentional disappearance .
867,i have to consume powder powder powder powder .,1,0,i bought this to grind xylitol and truvia sweeteners into a powder for cooking .
868,we usually run it on the lowest setting .,1,0,we usually run it on low and it is relatively quite .
869,% of the time my battery was dead .,1,0,it charges my phone very quickly and to full % battery .
870,"don t waste your money , i won t be buying it again .",1,0,"well worth the money , wouldn t want to be without it ."
871,i will not be buying an otterbox case again .,1,0,i will never have a phone without an otterbox again .
872,then i thought something was wrong with my car .,1,0,then i thought something was wrong with my car .
