id,target,s_label,t_label,source
219,"overall , i couldn t be happier with this case .",0,1,"whatever the case , i couldn t be more unhappy with this purchase ."
220,these make great little night lights for the kids .,0,1,these make great little night lights for the kids .
221,i ve not had this happen with my wusthofs .,0,1,i ve not had this happen with my wusthofs .
222,nothing fancy at all . this is a great addition to my kitchen .,0,1,"first , there is nothing about this to really write home about ."
223,the quality of this item is very reasonable .,0,1,the item was considerably different quality than pictured .
224,this cable is a standard cable for the price .,0,1,$ is too much to pay for a $ cable .
225,you won t have to worry about this knife .,0,1,hopefully you won t have to go through this nonsense .
226,i have not had any issues with others as others have noted .,0,1,i agree with the others that this was tough to open .
227,i find this way to be a great way to store them .,0,1,i must find a way to return them .
228,the volume control does not adjust to the touch sensitivity .,0,1,does increase volume but does not feel nice to the touch .
229,"as others have mentioned , i don t know how to use this case .",0,1,i don t see what others have liked about this .
230,i have a <UNK> <UNK> and this is my favorite .,0,1,i have no idea why this is a cult favorite .
231,the sound quality is great when it is on .,0,1,it makes an annoying sound when it is on .
232,these are a nice brand and i love them .,0,1,me too is a nice brand and make very comfortable shoes .
233,it s slim enough to fit the phone snugly in the slot .,0,1,with this i say i work giving support to the u . s .
234,this is the first bluetooth headset i own .,0,1,"first things first , make sure you are ordering the right headset ."
235,there are nothing special about the functionality and functionality of this case .,0,1,this game offers nothing unique and the graphics are not worth raving about .
236,this is a great product that saves energy and energy .,0,1,another energy product that simply wastes our money .
237,it is well made and easy to figure out .,0,1,very well designed and easy to figure out .
238,i enjoy having to keep the phone cool for a while .,0,1,this game gives you no incentive to keep playing .
239,i don t like the plastic cover covering the screen protector .,0,1,i thought this was the hard plastic screen cover and it isn t .
240,we bought this for our daughter who loves the <UNK> <UNK> .,0,1,would suggest using one of the toy bubblers amazon sells .
241,"it s perfect for rice , rice , rice , rice and rice .",0,1,"plus , it s not very filling , even for rice ."
242,i ve used it once and haven t used it once .,0,1,i ve used it once and i won t be using it again .
243,these cables work fine with micro usb cables .,0,1,"the cables seem rather basic and work well , except one problem ."
244,the price is great and i like the retractable cord .,0,1,this cord seemed like a deal and got good reviews .
245,this is a great product that does not disappoint .,0,1,that does not hold true for this product .
246,i have had high hopes for this product .,0,1,i had high hopes for this product since i bruise easily .
247,i filled the canister with a fuel filter .,0,1,this is called cheating ! i expected canister with fuel at least .
248,the case fits snuggly on the inside of the phone .,0,1,the inside of the case that contacts the phone is not smooth at all .
249,"opens cans cans , opens cans , opens cans with ease .",0,1,"it opens cans ok , but no better than the old fashioned openers ."
250,i d rather be a little more pleased with this set .,0,1,i d rather be a little less healthy and a little more happy .
251,we use this for our <UNK> num_num year old <UNK> .,0,1,try explaining to a two year old why her tattoo keeps breaking .
252,it was great for my kids and kids .,0,1,"the kids thought it was great , but it got old pretty quick ."
253,we have asthma and pets and pets and pets .,0,1,this did not stop odor and my pets wanted to eat it .
254,this unit has a modern modern operating system .,0,1,marineland does a very good job with their led aquarium systems .
255,"once again , the charger is charging the phone .",0,1,"once the charger is removed , the phone starts working , again ."
256,and theres no warning on any of these cans that i can identify .,0,1,and theres no warning on any of these cans that i can identify .
257,it arrived quickly and looks like it was supposed to .,0,1,like they glued it together and shipped it out it seemed .
258,i recently purchased a set of this set from amazon .,0,1,i did not purchase my set from this vendor .
259,"the design is outstanding , and the variety of shavings are endless .",0,1,"they are cheerios , afterall , and we love the original kind ."
260,it makes a farce out of a good num_num num_extend .,0,1,it makes a farce out of a good num_num num_extend
261,i live in an apartment where i live with it .,0,1,it could be that i live in an apartment with hills and trees around .
262,i got tired of a few days ago .,0,1,i miss my days of cracker eating before becoming gluten free .
263,my husband suffers from arthritis and accidents .,0,1,both rub my dog raw and cause bleeding .
264,the cost cost much more than i expected .,0,1,do not buy . i didn t expect much because of the cost .
265,i ordered these via eforcity for a party party party party .,0,1,i did not buy from a num_extend party seller .
266,this is a great spatula for the price .,0,1,"while the mascara is soft , it is not full ."
267,i ordered two of these and they arrived within a week .,0,1,i ordered two of them and both arrived within a week .
268,"also , it creates more static than the one i m used to .",0,1,"also , it creates more static than the one i m used to ."
269,the unit is very easy to use and clean .,0,1,overall it is inconvenient to keep the counter and the unit clean .
270,the part part part part is the part part part .,0,1,it s this second part that really grosses me out .
271,wusthof s knives are the best knives you can buy .,0,1,because these knives will greatly appreciate on the collector s market .
272,gave it to someone named happy on her birthday .,0,1,gave it to someone named happy on her birthday .
273,this apple corer is an official apple corer for num_num bucks .,0,1,just spend the extra bucks and buy an official one from apple .
274,"if you can afford that , this is a great buy .",0,1,absolutely horrid; cheaper @ costco if you must .
275,we have dozens of success with various brands of various j .,0,1,it took three years three vets and over twelve hundred dollars spent before success .
276,this is the way to write my review .,0,1,my first draft of this review was also way too long .
277,"other than that , the voice overs are all in the same place as well .",0,1,all the songs build on the same words .
278,it hasn t caused connection issues with my phone .,0,1,hasn t had to be rebooted yet due to connection issues .
279,i use it often and i m glad i did .,0,1,i kept it though i do not use it .
280,the concept was great and it worked great .,0,1,the concept was great and it worked very well when it worked .
281,it does a great job of boiling water in the water reservoir .,0,1,the did not a aborb water at all .
282,i use it with my ipod touch cassette player .,0,1,i adjusted the volumes on the ipod and the cassette player .
283,i am very pleased with the performance of this machine .,0,1,i was not at all pleased with the performance of this chopper .
284,i have had no issues with the construction of these glasses .,0,1,i have no padding of my own to offset hard soles .
285,easy access to access access to all ports .,0,1,and i wanted them all to be easy to access .
286,this is a good hoodie and well made .,0,1,this is a good hoodie and well made .
287,it s very easy to adjust the volume and volume buttons .,0,1,"it s very black , and it does add volume ."
288,the hooks are mounted on a high quality metal rod .,0,1,"cheap , low quality chicom scope with even cheaper ring mounts ."
289,first of all i m not some raging halo .,0,1,first of all i m not some raging halo .
290,i ve used misto spray spray spray spray spray spray sprayer and i have never had a problem .,0,1,i started using xlear nasal spray a few years ago .
291,we have discovered that there is a wide array of flexibility with similarly shaped corkscrews .,0,1,"first , and surprising was that they have removeable sole inserts ."
292,"overall , i think this is an improvement over priced .",0,1,"however , i feel civilization iv is most definitely not an improvement overall ."
293,i use them with <UNK> <UNK> and <UNK> <UNK> .,0,1,avoid the heartache and wasted titme of bad discs .
294,this stuff gets a lot of use with cast iron .,0,1,but this stuff will fall apart after only a few washings .
295,the company has saved me a lot of time .,0,1,company will exchange though but it wastes your time doing this .
296,"lasted for two games , during which i was the sole operator .",0,1,"lasted for two games , during which i was the sole operator ."
297,it is very sturdy and easy to clean .,0,1,very hard plastic and not that fun to play with at all .
298,i have been using this product for a long time .,0,1,save yourself some time and money and skip this product .
299,a process that takes a couple of minutes .,0,1,a process that takes a couple of minutes .
300,i use this for almond cheese and <UNK> .,0,1,i love cheetos and any artificially or naturally enhanced cheese snack .
301,hardly something i would give as a wrapped birthday gift .,0,1,hardly something i would give as a wrapped birthday gift .
302,the problem with the acrylic ones i ve found is the tipping factor .,0,1,the problem with the acrylic ones i ve found is the tipping factor .
303,i bought this to use for my droid x .,0,1,bought this for use to hold my droid incredible .
304,the feature feature feature is the feature that you can use for your phone .,0,1,that is right up until one day the record feature stopped working .
305,i also use the magnetic hook for my daughter .,0,1,my daughter used this for school for about num_num months until the strap broke .
306,i open the door door door and flipped it horizontally .,0,1,i have num_num bird feeders hanging from poles in my front and back yard .
307,i use this on the road for road trips at the time .,0,1,spent more time fiddling with this than i did looking at the road .
308,i don t have these pans for my long time .,0,1,don t waste your time or money on these jeans .
309,i use it on my hands and fingers .,0,1,i first used it on my hands and fingers .
310,the cord attaches to the headphone jack and headphone jack .,0,1,i also have to hold the headphone cord to keep it from flapping around .
311,not the fastest but better than my other hot air brush .,0,1,not the fastest but better than my other hot air brush .
312,i use it because i can rinse it out of the dish washer .,0,1,i threw it out because i can t take alcohol .
313,after that you have to pay a subscription .,0,1,after that you have to pay a subscription .
314,there is no way to put it in the dishwasher .,0,1,there s no way this will last as long as claimed .
315,oxo products are one of the best products i ve bought .,0,1,"i will still continue to use philosophy products , just not this one ."
316,this is the most efficient appliance we have ever owned .,0,1,certainly one of the more widely produced in the us .
317,i have the nokia num_extend and this one is just the ticket .,0,1,just reinstall the previous ghost recon and raven shield games .
318,"they fit nicely in the dishwasher , and even in the dishwasher .",0,1,"all of them are utter garbage , not even decent polyester ."
319,i highly recommend this product to anyone looking for their products .,0,1,i d suggest anyone looking to purchase linksys products look into netgear instead .
320,i use num_num gallon tanks per gallon tank .,0,1,good thing filters for num_num gallon tanks are cheap .
321,i can not believe i can use this opener .,0,1,"i might return it , but i need a can opener ."
322,i use this for dishwashing detergent and dishwashing detergent .,0,1,instead i would recommend cetaphil gentle cleanser and you will be fine .
323,it is perfect for sugar and sugar and sugar .,0,1,sugar is extremely addictive and does absolutely nothing for your body .
324,i use a paper towel around the neck .,0,1,i d rather tie a towel around my neck as a cape .
325,i use this to sit on my <UNK> <UNK> .,0,1,the constriction on my dog caused him to sit .
326,this case is the perfect case for the iphone .,0,1,the case fit okay but not attractive at all .
327,"as i get hit , my health endurance goes down .",0,1,"as i get hit , my health endurance goes down ."
328,the wheels are rolling up to the rolling pin .,0,1,they would flip off or get hung up due to poorly rolling wheels .
329,this unit is the only one i have ever had .,0,1,one thing is the amazingly poor unit a . i .
330,i use this type of strength booster strength .,0,1,i expected an improvement in signal strength from my tiny usb direct plugin type .
331,i highly recommend this product to anyone who is on the fence .,0,1,my first suggestion to anyone reading reviews on this product is to keep looking .
332,the reason for some reason is that it works great .,0,1,for some reason it worked out terribly for me .
333,this information information information information on the internet page page .,0,1,amazon does not provide enough information about this press .
334,"it is not as bad as the original battery , but it is so much better .",0,1,"multiplayer is just as bad , though thankfully not worse ."
335,i use it num_num minutes after num_num minutes .,0,1,i was bored after the first num_num minutes .
336,i use them for food prep food in my food processor .,0,1,i loved the food for my cats as you can read below .
337,made in france and common sense of nokia loyalty .,0,1,th product features and editorial review spell germany as the origin of manufacture .
338,i have several other headsets that work well with me .,0,1,it didn t work for me hopefully other people will have better luck .
339,the added benefit of the flavor is negligible .,0,1,"flavor : it has some tangy notes , and overall not bad ."
340,i ve had mine for a couple of years now .,0,1,"mine is a piece of junk , as far as i am concerned ."
341,the oval shape is much nicer than any of the metal colander you have with .,0,1,would have been alot nicer if it simply threaded in with the correct alignment .
342,these brushes are high quality and are easy to use .,0,1,it is best to invest in a good set of makeup brushes .
343,i am giving this item num_num stars because of the price .,0,1,i am only giving this item num_num stars because of the absurd price .
344,the light weight is light and light weight .,0,1,this does not appear to attract more mosquitos than the light does by itself .
345,it fits perfectly and is easy to snap together .,0,1,"it almost fit , but not enough to snap completely together and fit ."
346,there are a multitude of options for wallpapers and ringtones .,0,1,there is no menu selection for find free books .
347,"it s a pain to use , but i have no fear of burning it .",0,1,"i will always have slight pain , no matter what ."
348,the magnet is strong and the magnet is strong .,0,1,the material that it is made of is like a dirt magnet .
349,it heats up quickly and wears off after a few uses .,0,1,it works for maybe a few minutes and wears off quickly .
350,the directions are easy to follow and follow the directions .,0,1,the directions were easy to follow but the quality of the easel was pathetic .
351,i use this pressure cooker all the time .,0,1,"waste of money , waste of time , waste of blood ."
352,this case is exactly what i expected from otterbox .,0,1,this case is far from what i expected .
353,these are one of the best products i have ever owned .,0,1,too bulky and there are better products out there in single units .
354,my family loves them and they are the ones that come with her dinnerware .,0,1,does not give me any confidence in buying any of the discovery kids toys .
355,fill the water with hot water and pour the water .,0,1,i would suggest a more tropical flavor with chilled water .
356,the construction of these napkins are pretty good .,0,1,old grandson loves all things that have to do with construction .
357,i am a girl girl girl girl girl girl .,0,1,maybe a num_extend old girl could wear it .
358,i would buy another one for the price .,0,1,so please stop buying this and maybe they will lower the price .
359,i have had it for about num_num weeks now .,0,1,soe decided to push it to live a whole num_num weeks sooner than that .
360,i like that it is strong and strong .,0,1,"it s not overpowering , it is not like perfume ."
361,the sound quality is great and the volume control is great .,0,1,"num_extend has much better graphics , better sound , slightly better control ."
362,these headphones are very comfortable on your head .,0,1,also the headphones do not feel comfortable on your head .
363,claritin used to be the best thing around .,0,1,claritin used to be the best thing around .
364,i don t have anything else to say about it .,0,1,it really is like they didn t take anything at all .
365,the only thing i have done about it is that it cuts through everything .,0,1,i tried everything short of breaking the thing open .
366,"after reading other reviews , i decided to give this one a try .",0,1,"other reviews seemed more positive , but i just gave mine away ."
367,screen protectors are about % of the screen protector .,0,1,i dumped all num_num screen protectors in the trash bin .
368,the greatest part is that you can toggle the battery to your phone without damaging it .,0,1,does this ever happen to the cpu ? rarely .
369,i would buy this again in the future .,0,1,i would not buy this again in the future .
370,these bowls are the ones you can buy .,0,1,"crayola makes the best crayons , don t get me wrong ."
371,stainless steel will rust after a few washes .,0,1,"perhaps it won t rust , but upclose it looks a little cheesey ."
372,i keep it from sticking to my kitchen counter .,0,1,so i just thought maybe it ll help keep my acne away .
373,these headphones are the headphones for the headphones .,0,1,its tollable but thats not the best thing to say about headphones .
374,my wife has used this to make gravy and gravy .,0,1,my dog has started to become anxious at bedtime .
375,"after two months of use , i use it daily .",0,1,"so after two months of use , working in it ."
376,i read all the reviews on this one and i don t know why .,0,1,i don t know why it has all the good reviews .
377,"i don t really care for vegetables , vegetables , vegetables , vegetables , etc .",0,1,"there were other vegetables included , but you really couldn t taste them ."
378,the quality of materials is superb and the workmanship is superb .,0,1,the quality of materials and workmanship is noticeably less .
379,"i used this along with another similar product , for over num_num months .",0,1,"i used this along with another similar product , for over num_num months ."
380,i don t think you get what you pay for .,0,1,i don t think the saying you get what you pay .
381,these are great for sub par with premade companies .,0,1,if you want a cheaper sub deal with companies that specialize in that category .
382,enfamil infant is characterized by choline and dha .,0,1,enfamil infant is characterized by choline and dha .
383,it is so much easier to use and you can get the hang out of the sink .,0,1,you dont get so much sand with this .
384,"they are a bit pricey , but you get a little bit of pressure .",0,1,if you get these just be a bit careful .
385,i use it for a multitude of baking projects .,0,1,it reminds me more of silly putty than of a concealer .
386,i have had it for about num_num months now and it works great .,0,1,it worked for maybe num_num months then died .
387,this is a brand new bluetooth headset from sony .,0,1,this is not at all expected from a respected brand like sony .
388,i recently switched to a new brand of cookware .,0,1,my goof to not research this brand more .
389,i have used these on several sheets and i have yet to find them .,0,1,i found these patches very hard to put on .
390,i ve already been impressed with the otter box .,0,1,i ve not been terribly impressed with this box .
391,i will update this review if i ever need it .,0,1,i will add an update if i ever figure it out .
392,i always eat food in my food processor .,0,1,i tried hiding them in her food and in her treats .
393,this one doesn t handle the handle of the handle .,0,1,she didn t like the handle of this one at all .
394,the rubber band has rubber rubber outer rubber outer shell .,0,1,well it made it worse like a rubber band texture .
395,you ll have to experiment with grilled cheese .,0,1,i ll just stick with a good mayo and skip the bacon .
396,thank goodness the instructions are simple and intuitive .,0,1,thank heaven the operation is intuitive because there are no instructions .
397,i ve had this phone for over a week and i love it .,0,1,i thought i was over charged once it was returned .
398,i find them very useful and i love them .,0,1,i bought them and find them pretty annoying .
399,"after reading all the reviews , i decided to give this a try .",0,1,after all the great reviews i thought i d give this a try .
400,this product does a great job for me .,0,1,unfortunately this product did not do much for me .
401,i guess i ll get what i paid for .,0,1,you get what you pay for i guess .
402,"it also contains flour for flour , flour , flour , etc .",0,1,"it might work for all purpose flour , which has less gluten ."
403,i have had no problems with my experience .,0,1,"in my experience , they are a constant source of problems ."
404,i purchased these to use as a candy candy maker .,0,1,disappointed as i expected to received candy that would last a long time .
405,the waist cords are over a foot long after being taken in .,0,1,the waist cords are over a foot long after being taken in .
406,this car charger looks great and does its job .,0,1,"so , this car looks cool and all but its not that great ."
407,i have no idea how great this product works .,0,1,i have no idea if it s me or this product doing .
408,"also , you have to tilt the head onto your head .",0,1,"otherwise , they fall off your head at the slightest lean or tilt ."
409,just hurry up and play the darn song and move on for goodness sake .,0,1,just hurry up and play the darn song and move on for goodness sake .
410,"once you buy it , you won t regret it .",0,1,try it once and you won t think it s stupid .
411,this was a gift for my daughter and she loves it .,0,1,it was supposed to be a complete toy .
412,they soften up the sides of the bowl .,0,1,"nevertheless , the smell lasts for num_num or num_num minutes tops ."
413,they are made in china and are good quality .,0,1,good that they are from usa and not china ! .
414,i am very happy with this purchase so far .,0,1,so far i am not at all happy .
415,i purchased these when they arrived and i love them .,0,1,i purchased them and when they arrived they were torn .
416,i order this order to make sure you order them .,0,1,quite tasteless and they make you order so many .
417,it uses a micro usb connector for the camera .,0,1,camera fell of it after a few uses .
418,this is a must have in my kitchen .,0,1,i will never again purchase another game where this is a requirement .
419,it looks nice and does the job well .,0,1,"really , it all does look nice graphically wise ."
420,i prefer this style style style style style style style style .,0,1,its very similar to that type of style .
421,"i have been using it for a few years now , and my finger slides across my cheek .",0,1,"might have been nice , but just went over my cheeks ."
422,i love the shape of the oval shape .,0,1,the shape of the grains makes all the difference .
423,the cord is long enough to reach into an extension cord .,0,1,"first , without the extension they are very short ."
424,"i then emptied th coffee grinder and looked for an obstruction , none .",0,1,"i then emptied th coffee grinder and looked for an obstruction , none ."
425,they have a medium pile lining that has more of a stiffer polyester feel .,0,1,they have a medium pile lining that has more of a stiffer polyester feel .
426,it s <UNK> <UNK> <UNK> <UNK> <UNK> <UNK> <UNK> <UNK> .,0,1,nightwolf s friendship is cool too where he juggles his hammers .
427,they keep my ears warm and they look great .,0,1,it s too bad because they look like they would keep my ears warm .
428,spray oil with olive oil and oil oil .,0,1,these salmons are in water not vegetable oil .
429,i bought this grater along with an eye tool attachment .,0,1,when you place the eye brow attachment on you can get a mixed cut .
430,i will be buying more in the future .,0,1,i won t be buying any more in the future .
431,the color is beautiful and the color matches beautifully .,0,1,"i hated the color that was sent to me , pale chalky beige ."
432,the adhesive covering the outer layer with adhesive swabs on it .,0,1,that s not what it felt like with the original gel adhesive .
433,it fits my iphone num_num perfectly into the center of the dock .,0,1,the radtach procable num_num inch dock extender works only part way .
434,it is a great price for the price .,0,1,because it is definitely not worth full price .
435,i have had this item for many years .,0,1,i would not recommend this item for dogs who chew .
436,this is the first time i have used this knife .,0,1,this is the worst game i have come across in a long time .
437,i give this four stars because of the positive reviews .,0,1,unfortunately i m not sure what all the five star reviews are for .
