id,target,s_label,t_label,source
0,the lock holder locks securely onto the holder .,0,1,if your bike had a kickstand on the plate it won t lock down .
1,they are thinner and retain memory than the older ones .,0,1,they are thinner and retain memory than the older ones .
2,it makes a great sound in the car .,0,1,it makes a buzzing sound when devices are plugged in .
3,i ve never had a problem so far .,0,1,i could barely get through it they taste so nasty .
4,either than or the developers decided to do their own .,0,1,either than or the developers decided to do their own .
5,these shears are a pair of motorola shears .,0,1,the pair made in mexico is much better .
6,i m looking for something else to keep in the fridge .,0,1,i m selling mine to make room for something else .
7,i like it and it protects my screen .,0,1,it looks like i ve splashed glitter all over my face .
8,this method is the method to go with the traditional method method .,0,1,"went to the second one using the same method , no go ."
9,this model is much better than our older model .,0,1,it was not as good as our much cheaper model .
10,i use it at night on night night .,0,1,so not that great for leaving on at night .
11,i have emailed no response from response to the company .,0,1,when i contacted the company the response was that they shipped it .
12,"i have had many things that are great , and this one is great .",0,1,"and , there were many things we liked about this game ."
13,i have no trouble putting bubbles on it .,0,1,ridiculous ! i had trouble getting it on with zero bubbles .
14,"i ve used these things for a lot of things , so i really like them .",0,1,i ve been through so many of these ineffective silly things .
15,i ve had this for a few days now and i love it .,0,1,after a few days i noticed i was unusually fatigued .
16,the jawbone supreme bluetooth headset is vastly superior .,0,1,the jawbone may perform admirably as far as technology .
17,i bought this for my daughter for christmas .,0,1,did nt have time to return it before christmas so bought another necklass .
18,"there are num_num grams of flour , num_num grams of sugar , and num_num grams of protein .",0,1,another num_num calories from the other num_num grams of carbohydrates .
19,soft cotton feel cotton feel like cotton cotton .,0,1,"these are supposedly cotton , but they don t feel like it ."
20,my only complaint is that my <UNK> had a hairline crack .,0,1,one major complaint is the micromanagment of collecting shards .
21,i ve had no problems with the magnets on the magnets .,0,1,i tried supergluing the magnets back on to no avail .
22,i have not had any problems with it yet .,0,1,no comment on the strainer since i have not used it yet .
23,this is a great product and will be purchasing again .,0,1,overall we will not be purchasing this product again .
24,i would highly recommend this item from amazon .,0,1,hello;i purchased this item from a major retailer about num_num years ago .
25,i love the color and color of it .,0,1,i received the wrong color and it shreds easily .
26,hamilton beach hamilton beach hamilton beach hamilton beach hamilton beach mixer .,0,1,i will never buy hamilton beach products again .
27,note that they state the measurements state on the website .,0,1,the description on the website did not state that the straps were elastic .
28,they are easy to put on and <UNK> .,0,1,we re too stupid to put together normal sounding sentences .
29,the inside of the box is very sturdy and easily accessible .,0,1,the box is very shallow and not easily covered securely .
30,this brand name brand name is worth the money .,0,1,this is not worth the money and the brand name is misleading .
31,the magnets are cute and we can hang our jewelry in the garage .,0,1,the cars that come with this garage are cute .
32,i love the wusthof products that are always available .,0,1,"spyro games always used to be fun , but that tradition ends here ."
33,it has a usb connection to the computer when connected to my computer .,0,1,"the computer recognized the usb connection , but the cursor never moved ."
34,i purchased this product to use with my pressure cooker .,0,1,so i bought this product hoping it would help to regulate my cycles .
35,i would recommend this one to my friends .,0,1,i would not even give my current one away .
36,i have been using this for several months now and it works great .,0,1,we have been treating our hair for months and finally got this .
37,i bought this set for our toaster oven .,0,1,i bought this set for our toaster oven .
38,this is what you re looking for . . . . . . . . . . . . .,0,1,is that what you re looking for ? go elsewhere .
39,we have not had a problem with it .,0,1,not that we should of had to do that .
40,it feels very sturdy in my hand and i like it .,0,1,my mouth feels very dry and i am thirsty after drinking this .
41,i don t have to worry about keeping my food clean .,0,1,my cat just isn t at all interested in these springs .
42,obviously we all have our own preferences for taste .,0,1,obviously we all have our own preferences for taste .
43,i have had it for over a year now .,0,1,since that time i have replaced the game .
44,the price was right for a half hour .,0,1,surely not worth what was paid for it by half .
45,"i have used them all the time , and i love them .",0,1,"once you play one match , you ve played them all ."
46,next day i m going to use it every day .,0,1,i m just looking forward to the day i get to replace it .
47,oxo is a trustworthy brand of oxo products .,0,1,"i like neutrogena products as a rule , so this was a disappointment ."
48,this is a great value and unreal tournament .,0,1,the original unreal tournament is the very definition of fun .
49,i really like these things at the time .,0,1,"the first time through , things really slowed down around level num_extend"
50,"unlike other reviewers , i ve had no problems with the drivers .",0,1,two reviewers determined there are drivers to be downloaded but i was unsuccessful .
51,the bar contains a splash of flour which contains flour .,0,1,the bar contains agave nectar which does not occur naturally .
52,we have asthma stains in our apartment .,0,1,i couldn t stand the persistent smell of feces in my apartment .
53,"i put my tongue on the glass , and let them soak .",0,1,"first , i put them both under my tongue simultaneously ."
54,it does a great job on butter and butter .,0,1,not a good product for conditioning even though it says it has shea butter .
55,i love this case ! it provides a lot of protection for my phone .,0,1,i would never recommend this terrible waste of money case .
56,i ve used it several times and it works great .,0,1,i ve used it twice and it has stopped working .
57,i run it outside the window and connect it to a garden hose .,0,1,i run it outside the window and connect it to a garden hose .
58,i really like the style of this style .,0,1,can t imagine how it acts when you heat style your hair .
59,it s a perfect size for my coffee holder .,0,1,because it s too big for my cup holder .
60,thanks amazon to amazon for a great price .,0,1,amazon was good to give me a refund right away .
61,"i ve had it for some reason now , and it is no longer available .",0,1,"it crashed for no reason , saves got corrupted ."
62,i have had these for several years and love them .,0,1,i bought this toy for my boys a few years back .
63,"this isn t a problem for me , but isn t difficult to use .",0,1,"if you are sensitive to maltodextrin , this isn t for you ."
64,then contact sharp and go on from there .,0,1,then contact sharp and go on from there .
65,waffle maker num_extend num_extend num_extend num_extend waffle maker num_extend,0,1,we ve tried num_num of these waffle makers since jan num_extend
66,i bought this to use with my nokia num_extend,0,1,"i ll stick to my xbox for now , thanks ."
67,i ve used them a few times and they are very sturdy .,0,1,i ve used these a few times and broke them very easily .
68,it sits on our shelf collecting dust dust .,0,1,this one sits on our shelf collecting dust .
69,we received two of these in our house and within a few days .,0,1,two days later i no longer saw them anywhere on the building .
70,i bought this recently for my dad .,0,1,i hate myself for falling for the james bond license and wasting $
71,"if you don t have an electric grill , this is the one you can buy .",0,1,don t buy this unless you like replacing toasters .
72,you will have to use ice cream for cream .,0,1,this cream will give you acne if you have sensitive skin .
73,i have not had any problems from this brand .,0,1,i would not buy anything else from this vendor .
74,i use them mostly because of the slanted grains and grains .,0,1,i could feel some of the grains even after much shaking .
75,"the base base is very sturdy , and the base base is easy to clean .",0,1,"and after all that , the base broke too ."
76,my only concern is that i have a hard plastic bowl .,0,1,the aftertaste is so overpowering i had to brush my teeth .
77,i am using mason jars to seal jars .,0,1,i am actually afraid to open the remaining jars .
78,"it is light weight , light weight , and light weight .",0,1,"the charging light illuminates , but does not charge ."
79,this is exactly what i was looking for .,0,1,the product is not durable but it might just be the one i received .
80,then she said well you ordered the pu which is what you got .,0,1,then she said well you ordered the pu which is what you got .
81,i have had no problems with rust rust .,0,1,i didn t have the rust problems that others had .
82,this is my second one for my dad .,0,1,"in that short time , he ripped one wing off the toy ."
83,this item is exactly as described in the picture .,0,1,this item does not provide full coverage as the picture suggests .
84,these work well for reducing your nasal passages .,0,1,these definitely open up your nasal passages and functionally work as advertised .
85,"this is a great product , has some minor flaws .",0,1,"this is a fantastic idea , however it has some flaws ."
86,if you can afford it step up to something that will last .,0,1,if you can afford it step up to something that will last .
87,this is the best case i have ever used .,0,1,i won t be buying from this vender ever again .
88,my daughter thinks the retro retro retro design is great .,0,1,i thought the concept was good; scuffy thinks otherwise .
89,i have been using this pan for a month now .,0,1,every product i own from them has failed or been a letdown .
90,i like this case for my iphone num_extend,0,1,i would not trust anything bigger than iphone num_extend
91,i have a newer version of the original version .,0,1,i have a made in usa version of this .
92,i use these glasses for my feet and feet .,0,1,then i put the cream on my feet especially around my toes and heels .
93,easy to store and store in the store .,0,1,you can go to any chain store and do better .
94,i have a cast iron wok that works well with cast iron .,0,1,i simply treated it how i would assume a curling iron works .
95,the included option is also a bonus option .,0,1,also the free will option is an absolute joke .
96,if you are stir frying your ingredients i . e .,0,1,if you are stir frying your ingredients i . e .
97,"of course , there s no sign of battery life .",0,1,"of course in most sports games , graphics shouldn t matter ."
98,i had it professionally installed at a local bike shop .,0,1,i had it professionally installed at a local bike shop .
99,the ring on the inside of the lid is great .,0,1,this ring looked beautiful on out of the box .
100,i did some research and settled on this one .,0,1,"i did some research , and went with this one ."
101,i use this for a couple of weeks .,0,1,i figured this would be a great alternative to use during the six weeks .
102,i bought this as a gift for my mom for christmas .,0,1,i bought this for my num_num month old from santa for christmas .
103,we bought this for our daughter and she loves it .,0,1,we purchased this so our daughter could have fun toy to play with .
104,please reply with the filter part number and your location .,0,1,please reply with the filter part number and your location .
105,i use it with olive oil and an olive oil .,0,1,i woke up with basically an oil slick on my face .
106,i bought this for my husband and he loves it .,0,1,i put it together to surprise my husband .
107,you can coat anything else or coat it .,0,1,it hasn t done anything for his thin coat though .
108,arrived within a few days of days .,0,1,they send you num_num because each one lasts about two days .
109,i like that i read so many good reviews on this one .,0,1,i felt i must have missed something if the reviews were so good .
110,this is a high rating on the bottom of the line .,0,1,i have to lower the rating another notch .
111,i have a motorola droid razr maxx car mount .,0,1,i have purchased fairly cheap holders from motorola and they lasted a while .
112,i like the shape and shape of the jars .,0,1,i was surprised as the box seemed to be in good shape .
113,i ve been using this charger for a couple of months .,0,1,i was looking forward to this game for a couple of num_extend
114,"even though they are large , they are quite large .",0,1,these run quite small even though they are stretchy .
115,i use these gloves with gloves and gloves .,0,1,i think i will return and stick with wool gloves .
116,"there are plenty of apps and widgets , and this is by far the best .",0,1,"like showdown : legends of wrestling , it has too many glitches to count ."
117,"this means that you have two of these types of knives , which means your hand will be safe .",0,1,if you have soft facial fair then by all means use these razors .
118,i gave it to my sister and she loves it .,0,1,she handed it back to me and picked up her ginsu knife .
119,"i like the taste of honey , honey , and honey .",0,1,"got all excited , but this taste nohthing like honey at all ."
120,it cuts smoothly and is easy to put on .,0,1,it scrolls way too easily and way too smoothly .
121,"a little at first , more with each successive try .",0,1,"a little at first , more with each successive try ."
122,i use it to store my phone in the car .,0,1,i had to get some from the phone store .
123,you can charge it in the car with your car .,0,1,you can probably run them over with your car and still be okay .
124,you can mount the mount to the windshield and turn it on .,0,1,the wheel oftenly stuck and wont turn on its rail .
125,there is a delay between the scala num_extend,0,1,most operations there is a noticable delay lag of num_extend to num_num seconds .
126,this is a genuine oem cable that works perfectly .,0,1,there was nothing at all to indicate that belkin manufactured this item .
127,"my little girl wanted this for her birthday , so we got it .",0,1,"my little girl wanted this for her birthday , so we got it ."
128,this is a genuine motorola num_extend and the motorola oasis has performed admirably .,0,1,this meter is technology from a decade ago .
129,the clip of the belt clip is very secure .,0,1,i do not like this belt because of lack of material .
130,i love the quality and quality of these .,0,1,too small and not the quality i expected .
131,it keeps the air hot air into the air .,0,1,it just smears it around until the water evaporates into the air .
132,"as others have mentioned , i like this product .",0,1,i purchased this based on rave reviews from others .
133,i guess this is a must have for many people .,0,1,i guess maybe there are some people that this product could help .
134,i use this platter in lieu of transferring vodka in the freezer .,0,1,with sliced cheese in lieu of french bread on a fruit and cheese plate .
135,it doesn t smell like a lot of water .,0,1,it didn t have the smell a lot complained of though .
136,i use it every day when i charge it .,0,1,i have been using it twice a day since i received it .
137,i have had no internet connection to my wifi network .,0,1,i put in a password but router won t recoginize it .
138,the controls are precise and gives me a headache .,0,1,"worse , the controls are so confusing that it gives me a headache ."
139,now i don t have to buy a bluetooth headset .,0,1,now i have a game that i don t ever want to play .
140,the interface is intuitive and user interface is very intuitive .,0,1,nokia knows how to design a very good interface .
141,this is a great product for a cookbook .,0,1,"basically , this product is a ripoff on consumers ."
142,this is honestly the only case i ve thrown away in the garbage .,0,1,this is honestly the only case i ve thrown away in the garbage .
143,i ve had many lighters and this one might be the best .,0,1,i ve had many lighters and this one might be the best .
144,its good that its made in canada rather than china .,0,1,its good that its made in canada rather than china .
145,this is a great replacement for the new set .,0,1,this machine is no match for the new consoles .
146,i have been drinking rice from the company for decades .,0,1,i contacted the company and they said that the shipment had been lost .
147,i like that it s programmable and ground ground <UNK> .,0,1,it s the lame players that drives halo multiplay into the ground .
148,i saw this on america s test kitchen and it works great .,0,1,good for one day only . and opi test this product on animals .
149,you shouldn t run long to run out of pressure .,0,1,"first of all , syrup shouldn t run , it should ooze ."
150,"it comes in handy , which makes it very convenient .",0,1,"also it gets very hot while plugged in , which freaked me out ."
151,i have used this product and it does the job .,0,1,returned product but from what i ve heard it does the job .
152,the coffee tastes delicious and the coffee tastes delicious .,0,1,drinking the coffee was slightly less unpleasent than the smell suggested it would be .
153,it is sticky and sticky and gets sticky .,0,1,it is worse then no lube because it gets soooo sticky .
154,we use it all sorts of food for food prep .,0,1,birds or squirrels . tried num_num different kinds of bird food .
155,"however , this battery does a great job .",0,1,"however , definitely does not work like a new battery ."
156,i learned my lesson to learn how to make a fondue pot .,0,1,"what a ripoff ! learn from my mistake , do not buy ."
157,the phone is very smooth and works just fine .,0,1,and still the focus was extremely soft or just plain terrible .
158,i like the rubber grip with rubber grips .,0,1,i also tried a cheaper brand of slip on rubber broad heads .
159,the glass container contains glass containers unlike glass containers .,0,1,other brands in this large of a container are glass .
160,"yes , they are sturdy , but they are sturdy and do not stain at all .",0,1,"yes , they are light , and are not durable at all ."
161,i have a case that fits my phone perfectly .,0,1,she could have decorated her carrying case herself .
162,it allows you to make homemade rice or flours .,0,1,there are companies that make dog biscuits with the activated charcoal in it .
163,i ve learned that companies make varying degrees of quality .,0,1,i ve learned that companies make varying degrees of quality .
164,i was looking for something that would work better .,0,1,"thought , hey why not try something different might work ."
165,audio isn t a religion and these are not holy water .,0,1,audio isn t a religion and these are not holy water .
166,the only thing i like is the <UNK> <UNK> <UNK> .,0,1,the real thing is nong shim shin noodle ramyun .
167,it attaches to the neck and doesn t move around the neck .,0,1,this just doesn t have enough power to massage my shoulders and neck .
168,with a couple of bucks you could make something a lot better yourself .,0,1,with a couple of bucks you could make something a lot better yourself .
169,i ve ordered several pairs of these and have had no luck with them .,0,1,i had much better luck with the other three pairs mentioned .
170,the retractable cord ends up on the ends of the cord .,0,1,it s like i got an extension cord and male outlets on both ends .
171,the rubber lid on the bottom of the bowl has a soft rubber sticking to it .,0,1,the bowl is too light we even had it on a rubber mat .
172,"it has rubber rubber grips over the bottom of the phone , and it will last a long time .",0,1,"will break in over time though , it s rubber ."
173,you can lift the wire up on the handle .,0,1,it is so small . get a racket ball . pass this one by .
174,the fact that they are large enough to incorporate food into your food is a breeze .,0,1,that is not to say that these treats are bad by any means .
175,the buttons to extend the arms worked exactly one time before breaking .,0,1,the buttons to extend the arms worked exactly one time before breaking .
176,i m sure it depends on your age and body type .,0,1,i m sure it depends on your age and body type .
177,the signal strength is ample strength and interferes with my iphone num_extend,0,1,the transmit strength on this compact num_extend is pretty strong .
178,this is a handy little gadget if you don t mind having one in mind .,0,1,"generally if a toy makes noise , i don t mind so much ."
179,nothing fancy about this product and i absolutely love it .,0,1,there was almost nothing i liked about this product .
180,i received this product for a few days straight out of the package .,0,1,i used the product for five days straight before running out .
181,so i guess it s really a matter of preference .,0,1,so i guess it s really a matter of preference .
182,warranty warranty has a lifetime warranty warranty warranty .,0,1,"first of all , this will void whatever warranty you have with microsoft ."
183,and it is very possible that these are good cables .,0,1,and it is very possible that these are good cables .
184,this is a replacement case for the iphone .,0,1,the bottom part is stretching after only a month of owning the case .
185,i don t use anything else on my face .,0,1,but it didn t do anything for my face .
186,i bought this for my daughter for christmas .,0,1,i got this for my num_num month old daughter for christmas .
187,i have used it about once a week .,0,1,"they pee in it about once a week , if that ."
188,i like them so much i bought two of these .,0,1,i only ordered on here because they were alot cheaper .
189,the micro usb port allows you to charge your phone .,0,1,insert the micro usb to your phone and enjoy your widescreen display .
190,it adds a bit of bulk to the phone .,0,1,"to ataris credit , this game was a bit fun ."
191,i m a guy who is clumsy and i have arthritis .,0,1,i say this as a guy with fairly thin wrists too .
192,easy to remove and remove the screen protector .,0,1,trying to slide to a different screen instantly turns it back off .
193,"it s not too heavy , and it s very versatile .",0,1,it not educational or exciting and it s annoying .
194,worth the extra cost for the iphone num_extend,0,1,i spent $ for the num_extend and overall it was not worth the cost .
195,the spiral wheel is a little curved towards the underside of the cutting board .,0,1,im thinking num_num gem stones in at least a num_num inch wheel .
196,i can use a creamy concealer on it .,0,1,i can use a creamy concealer on it .
197,it s a shame that their products are great quality .,0,1,shame on what otherwise has been a reliable company with several other respectful products .
198,i bought this to replace my husband and he loves it .,0,1,my husband said it was obvious so i had to return it .
199,i highly recommend this to anyone with an extended <UNK> .,0,1,speedloader is very hard to use especially with an extended magazine .
200,"if you need a usb charger , this charger will charge your phone .",0,1,mind you the oem xoom charger is not like that at all .
201,"nothing special about the price tag , but the price tag is great .",0,1,"for the price tag , its nothing to rave about ."
202,i like the fact that it holds a few pieces of pieces .,0,1,i mean she felt apart she broked down in a hundred pieces .
203,i turn it on the road when i take out of the road .,0,1,i had to buy one out on the road .
204,this is a great variety of coffee in the kitchen .,0,1,this particular variety is rather lacking in the flavor department .
205,"i m tired of cheaply made , high priced appliances .",0,1,"i m tired of cheaply made , high priced appliances ."
206,i m buying this to replace my old one .,0,1,i won t give this to the new puppy i m getting .
207,i use this for scrambled eggs and fried eggs .,0,1,"i bought this skillet for steaks and fried potatoes , and fried eggs ."
208,i also purchased mine directly from amazon in the store .,0,1,note that i got mine from an amazon store called small appliance .
209,i feel like i wasted money on this one .,0,1,i practically felt like i threw away my money on this one .
210,it fits snug and snug fitting with snug fitting .,0,1,maybe it just needs broken in and some fine fitting .
211,i ve had it for a couple of days now and i love it .,0,1,"after four days of that , i gave up and chucked it ."
212,i bought this in december num_num and it came out perfect .,0,1,in num_num thq came out with this wrestling game .
213,i haven t had a chance to use them yet .,0,1,i didn t have enough of them to return .
214,i have been using this for a while .,0,1,i cannot recommend this product for anyone trying to fix a leaky transmission .
215,this is a very good product for me .,0,1,for me this was a most disappointing product .
216,this is a high quality product and is a good price .,0,1,this is just a little too low quality .
217,the lid is the best part of the pot ensemble .,0,1,the lid is the best part of the pot ensemble .
218,this is due to the short lived cheaper lasers they put in them .,0,1,this is due to the short lived cheaper lasers they put in them .
